SG_UF_PROVA;CO_MUNICIPIO_PROVA;NO_MUNICIPIO_PROVA;CO_COORDENACAO;CO_LOCAL;NO_LOCAL_PROVA
RJ;3304557;RIO DE JANEIRO;51373;P70153;UNIVERSIDADE VEIGA DE ALMEIDA (UVA)
RJ;3304557;RIO DE JANEIRO;51374;P70153;UNIVERSIDADE VEIGA DE ALMEIDA (UVA)
RJ;3304557;RIO DE JANEIRO;51383;P70203;UNIVERSIDADE ESTÁCIO DE SÁ - CAMPUS ILHA DO GOVERNADOR
RJ;3304557;RIO DE JANEIRO;51391;P70208;UNIVERSIDADE ESTÁCIO  DE SÁ - CAMPUS VIA BRASIL
RJ;3304557;RIO DE JANEIRO;51381;P70210;IBMR -  BOTAFOGO
RJ;3304557;RIO DE JANEIRO;51375;P70297;UNIVERSIDADE ESTÁCIO DE SÁ - CAMPUS MARACANÃ
RJ;3304557;RIO DE JANEIRO;51394;P70310;ESTÁCIO - CAMPUS TAQUARA R9
RJ;3304557;RIO DE JANEIRO;51393;P70503;UNIVERSIDADE ESTÁCIO DE SÁ - CAMPUS MADUREIRA
RJ;3304557;RIO DE JANEIRO;51392;P70780;UNIVERSIDADE ESTÁCIO DE SÁ- CAMPUS NOVA AMÉRICA
RJ;3304557;RIO DE JANEIRO;51395;P70798;UNIVERSIDADE ESTÁCIO DE SÁ - CAMPUS TOM JOBIM
RJ;3304557;RIO DE JANEIRO;51396;P70798;UNIVERSIDADE ESTÁCIO DE SÁ - CAMPUS TOM JOBIM
RJ;3304557;RIO DE JANEIRO;51371;P70812;UNIVERSIDADE ESTÁCIO DE SÁ - CAMPUS SULACAP
RJ;3304557;RIO DE JANEIRO;51372;P70820;UNIVERSIDADE ESTÁCIO DE SÁ - CAMPUS PRESIDENTE VARGAS
RJ;3304557;RIO DE JANEIRO;51386;P74275;IBMR INSTITUTO BRASILEIRO DE MEDICINA E REABILITAÇÃO -CATETE
RJ;3304557;RIO DE JANEIRO;51378;P74307;UNIVERSIDADE FEDERAL DO RIO DE JANEIRO - UFRJ -+ PRAIA VERMELHA
RJ;3304557;RIO DE JANEIRO;51379;P74307;UNIVERSIDADE FEDERAL DO RIO DE JANEIRO - UFRJ -+ PRAIA VERMELHA
RJ;3304557;RIO DE JANEIRO;51384;P74330;UNIVERSIDADE FEDERAL DO RIO DE JANEIRO (UFRJ) - LETRAS
RJ;3304557;RIO DE JANEIRO;51385;P74330;UNIVERSIDADE FEDERAL DO RIO DE JANEIRO (UFRJ) - LETRAS
RJ;3304557;RIO DE JANEIRO;51387;P74330;UNIVERSIDADE FEDERAL DO RIO DE JANEIRO (UFRJ) - LETRAS
RJ;3304557;RIO DE JANEIRO;51388;P74330;UNIVERSIDADE FEDERAL DO RIO DE JANEIRO (UFRJ) - LETRAS
RJ;3304557;RIO DE JANEIRO;51389;P74330;UNIVERSIDADE FEDERAL DO RIO DE JANEIRO (UFRJ) - LETRAS
RJ;3304557;RIO DE JANEIRO;51376;P74331;UFRJ - CENTRO DE TECNOLOGIA - CT
RJ;3304557;RIO DE JANEIRO;51377;P74331;UFRJ - CENTRO DE TECNOLOGIA - CT
RJ;3304557;RIO DE JANEIRO;51380;P74331;UFRJ - CENTRO DE TECNOLOGIA - CT
RJ;3304557;RIO DE JANEIRO;51382;P74331;UFRJ - CENTRO DE TECNOLOGIA - CT
RJ;3304706;SANTO ANTONIO DE PADUA;51441;P72144;COLÉGIO ESTADUAL ALMIRANTE BARÃO DE TEFFÉ
RJ;3304755;SAO FRANCISCO DE ITABAPOANA;51360;P72211;C. E. SÃO FRANCISCO DE PAULA
RJ;3304805;SAO FIDELIS;51359;P72020;COLÉGIO ESTADUAL SÃO FIDELIS
RJ;3304904;SAO GONCALO;51443;P70286;UNIVERSIDADE ESTÁCIO DE SÁ
RJ;3304904;SAO GONCALO;51444;P70473;COLÉGIO MUNICIPAL ESTEPHÂNIA DE CARVALHO
RJ;3304904;SAO GONCALO;51445;P70474;CIEP 125 - PROFESSOR PAULO ROBERTO MACEDO DO AMARAL
RJ;3305000;SAO JOAO DA BARRA;51446;P72682;COLÉGIO ESTADUAL ALBERTO TORRES
RJ;3305109;SAO JOAO DE MERITI;51414;P71018;UNIVERSIDADE ESTÁCIO DE SÁ CAMPUS SÃO JOÃO DE MERITI
RJ;3305208;SAO PEDRO DA ALDEIA;51356;P71853;COLÉGIO ESTADUAL DOUTOR FELICIANO SODRE
RJ;3305406;SAPUCAIA;51398;P73055;ESCOLA MUNICIPAL Dª MARIA DE LOURDES SALOMÃO
RJ;3305505;SAQUAREMA;51346;P70710;ESTÁCIO - PÓLO GRAVATÁ - SAQUAREMA
RJ;3305554;SEROPEDICA;51418;P70152;UFRRJ
RJ;3305752;TANGUA;51399;P72035;CIEP BRIZOLÃO 252 - JOÃO BAPTISTA CAFFARO
RJ;3305802;TERESOPOLIS;51447;P71221;ESTÁCIO
RJ;3306008;TRES RIOS;51449;P70926;UNIVERSIDADE FEDERAL RURAL DO RIO DE JANEIRO - INSTITUTO TRÊS RIOS
RJ;3306107;VALENCA;51350;P72129;CENTRO UNIVERSITÁRIO DE VALENÇA
RJ;3306206;VASSOURAS;51351;P71996;UNIVERSIDADE DE VASSOURAS
RJ;3306305;VOLTA REDONDA;51451;P69052;INSTITUTO DE CULTURA TÉCNICA
RJ;3306305;VOLTA REDONDA;51452;P69052;INSTITUTO DE CULTURA TÉCNICA
RN;2400208;ACU;50549;P71896;ESCOLA ESTADUAL MARCOS ALBERTO DE SÁ LEITÃO
RN;2401008;APODI;50557;P71913;ESCOLA ESTADUAL FERREIRA PINTO
RN;2401305;AUGUSTO SEVERO (CAMPO GRANDE);50561;P71983;ESCOLA MUNICIPAL DE 1º E 2º GRAU PROFº JOAQUIM LEAL PIMENTA
RN;2402006;CAICO;50551;P70923;CENTRO DE ENSINO SUPERIOR DO SERIDO - UFRN - CAMPUS DE CAICÓ
RN;2402600;CEARA-MIRIM;50562;P71767;E. E. INTERVENTOR UBALDO BEZERRA
RN;2403103;CURRAIS NOVOS;50552;P71100;UFRN/FELCS - FACULDADE DE ENGENHARIA,LETRAS E CIÊNCIAS SOCIAIS DO SERIDÓ
RN;2403251;PARNAMIRIM;50572;P70421;ESCOLA MUNICIPAL PROFESSORA IVANIRA DE VASCONCELOS PAISINHO
RN;2403608;EXTREMOZ;50563;P72046;E.M. PROF. VERA LÚCIA GONÇALVES
RN;2404200;GOIANINHA;50564;P71624;EM HELIO MAMEDE F GALVÃO
RN;2405801;JOAO CAMARA;50565;P71790;ESCOLA ESTADUAL FRANCISCO DE ASSIS BITTENCOURT
RN;2407104;MACAIBA;50566;P71874;ESCOLA ESTADUAL ARCELINA FERNANDES
RN;2407203;MACAU;50550;P71933;INSTITUTO FEDERAL DE EDUCAÇÃO CIÊNCIA TECNOLOGIA DO RIO GRANDE DO NORTE - CAMPUS MACAU
RN;2408003;MOSSORO;50555;P70086;UFERSA - UNIVERSIDADE FEDERAL RURAL DO SEMI-ÁRIDO - MOSSORÓ
RN;2408003;MOSSORO;50556;P70086;UFERSA - UNIVERSIDADE FEDERAL RURAL DO SEMI-ÁRIDO - MOSSORÓ
RN;2408102;NATAL;50567;P69005;CENTRO UNIVERSITÁRIO RIO GRANDE DO NORTE- UNI-RN
RN;2408102;NATAL;50568;P69005;CENTRO UNIVERSITÁRIO RIO GRANDE DO NORTE- UNI-RN
RN;2408102;NATAL;50569;P71101;UNIVERSIDADE FEDERAL DO RIO GRANDE DO NORTE (UFRN) - SETOR DE AULAS IV
RN;2408102;NATAL;50570;P71101;UNIVERSIDADE FEDERAL DO RIO GRANDE DO NORTE (UFRN) - SETOR DE AULAS IV
RN;2408300;NOVA CRUZ;50571;P71833;EETI ROSA PIGNATARO
RN;2408904;PARELHAS;50553;P70523;ESCOLA ESTADUAL JESUS MENINO
RN;2409308;PATU;50558;P71834;ESCOLA MUNICIPAL RAIMUNDO ROCHA
RN;2409332;SANTA MARIA;50573;P71897;ESCOLA MUNICIPAL JOÃO MARQUES DE ARAÚJO
RN;2409407;PAU DOS FERROS;50559;P70622;INSTITUTO FEDERAL DE EDUCAÇÃO, CIÊNCIA E TECNOLOGIA
RN;2411205;SANTA CRUZ;50554;P70700;ESCOLA ESTADUAL PROFESSOR FRANCISCO DE ASSIS DIAS RIBEIRO
RN;2412005;SAO GONCALO DO AMARANTE;50574;P71832;E.E PADRE JOSÉ MARIA BIEZINGER
RN;2412203;SAO JOSE DE MIPIBU;50575;P71756;ESCOLA MUNICIPAL PROFESSOR SEVERINO BEZERRA DE MELO
RN;2412500;SAO MIGUEL;50560;P71831;ESCOLA MUNICIPAL ELISIARIO DIAS
RN;2412609;SAO PAULO DO POTENGI;50577;P71773;ESCOLA ESTADUAL MAURÍCIO FREIRE
RN;2413003;SAO VICENTE;50576;P71841;ESCOLA MUNICIPAL FRANCISCA PIRES DE ALBUQUERQUE
RO;1100015;ALTA FLORESTA DOESTE;50407;P72286;EEEFM EURIDICE LOPES PEDROSO
RO;1100023;ARIQUEMES;50386;P71958;EEEFM ANÍSIO TEIXEIRA
RO;1100049;CACOAL;50389;P72580;ESCOLA ESTADUAL DE ENSINO MÉDIO EM TEMPO INTEGRAL JOSINO BRITO
RO;1100049;CACOAL;50390;P72585;EEEFM CORA CORALINA
RO;1100056;CEREJEIRAS;50410;P71469;CEEJA CARLOS DRUMOND DE ANDRADE
RO;1100064;COLORADO DO OESTE;50411;P73148;ESCOLA PAULO DE ASSIS RIBEIRO
RO;1100098;ESPIGAO DOESTE;50391;P71646;EMEIEF TEOBALDO FERREIRA
RO;1100106;GUAJARA-MIRIM;50393;P71961;COLÉGIO TIRADENTES DA POLÍCIA MILITAR-CTPM-X
RO;1100114;JARU;50394;P72836;EEEFM OLGA DELLAIA
RO;1100122;JI-PARANA;50396;P72697;FUNDAÇÃO UNIVERSIDADE FEDERAL DE RONDÔNIA - UNIR JI-PARANÁ
RO;1100130;MACHADINHO DOESTE;50395;P71859;EEEFM JOAQUIM PEREIRA DA ROCHA
RO;1100148;NOVA BRASILANDIA DOESTE;50403;P73151;E.E.E.F ALEXANDRE DE GUSMÃO
RO;1100155;OURO PRETO DO OESTE;50398;P72275;EEEFM JOAQUIM DE LIMA AVELINO
RO;1100189;PIMENTA BUENO;50392;P72164;E.E.E.F.M.PROFESSOR VALDIR MONFREDINHO
RO;1100205;PORTO VELHO;50404;P70080;EEEFM PROFESSORA FLORA CALHEIROS COTRIN
RO;1100205;PORTO VELHO;50405;P73429;INSTITUTO ESTADUAL DE EDUCAÇÃO CARMELA DUTRA
RO;1100205;PORTO VELHO;50406;P74244;INSTITUTO FEDERAL DE EDUCAÇÃO CIÊNCIAS E TECNOLOGIA DE RONDÔNIA - IFRO CAMPUS PORTO VELHO CALAMA
RO;1100288;ROLIM DE MOURA;50408;P71225;EMTI CÂNDIDO PORTINARI
RO;1100304;VILHENA;50412;P72930;EEEFM MARECHAL RONDON
RO;1100320;SAO MIGUEL DO GUAPORE;50409;P72801;CEEJA GETÚLIO VARGAS
RO;1100338;NOVA MAMORE;50399;P73062;EEEFM PROFESSOR SALOMÃO SILVA
RO;1100379;ALTO ALEGRE DOS PARECIS;50385;P72400;ESCOLA ARTUR DA COSTA E SILVA
RO;1100452;BURITIS;50387;P71287;E E E F M MARIA DE ABREU BIANCO
RO;1100809;CANDEIAS DO JAMARI;50400;P73352;ESCOLA CARLOS DRUMMOND DE ANDRADE
RO;1100924;CHUPINGUAIA;50401;P73688;UAB - UNIVERSIDADE ABERTA DO BRASIL
RO;1101104;ITAPUA DO OESTE;50402;P74227;EEEFM PAULO FREIRE
RO;1101302;MIRANTE DA SERRA;50397;P71768;EEEF FLORIZEL LAMEGO FERRARI
RO;1101401;MONTE NEGRO;50388;P71755;EEEFM AURÉLIO BUARQUE DE HOLANDA FERREIRA
RR;1400100;BOA VISTA;50017;P68365;CENTRO UNIVERSITÁRIO ESTÁCIO DA AMAZÔNIA
RR;1400100;BOA VISTA;50018;P68365;CENTRO UNIVERSITÁRIO ESTÁCIO DA AMAZÔNIA
RR;1400472;RORAINOPOLIS;50019;P73012;UERR - CAMPUS RORAINÓPOLIS
RR;1400506;SAO JOAO DA BALIZA;50020;P73508;ESCOLA MUNICIPAL DARCY PEDROSO DA SILVA
RS;4300109;AGUDO;51164;P73208;EEEB PROFESSOR WILLY ROOS
RS;4300406;ALEGRETE;51279;P70744;UNIVERSIDADE FEDERAL DO PAMPA - CAMPUS ALEGRETE (UNIPAMPA)
RS;4300604;ALVORADA;51207;P70954;COLÉGIO ESTADUAL ANTÔNIO DE CASTRO ALVES
RS;4300646;AMETISTA DO SUL;51208;P73363;E.E.E.M. SÃO GABRIEL
RS;4301008;ARROIO DO MEIO;51209;P73321;ESCOLA MUNICIPAL DE ENSINO FUNDAMENTAL SÃO CAETANO
RS;4301107;ARROIO DOS RATOS;51165;P71723;UNIVERSIDADE ABERTA DO BRASIL UAB POLO ARROIO DOS RATOS
RS;4301206;ARROIO DO TIGRE;51166;P72133;E.E.DE ENSINO MÉDIO ARROIO DO TIGRE
RS;4301305;ARROIO GRANDE;51210;P73214;INSTITUTO ESTADUAL EDUCACIONAL AIMONE SOARES CARRICONDE
RS;4301404;ARVOREZINHA;51211;P73488;ESCOLA MUNICIPAL CIVICO MILITAR ORESTES DE BRITTO SCHEFFER
RS;4301602;BAGE;51167;P70725;UNIVERSIDADE FEDERAL DO PAMPA - UNIPAMPA
RS;4301909;BARRA DO RIBEIRO;51212;P73470;UNIASSELVI POLO BARRA DO RIBEIRO
RS;4302105;BENTO GONCALVES;51173;P72217;UNIVERSIDADE DE CAXIAS DO SUL – CAMPUS UNIVERSITÁRIO DA REGIÃO DOS VINHEDOS
RS;4302204;BOA VISTA DO BURICA;51169;P73434;EEB BARÃO DO RIO BRANCO
RS;4302402;BOM RETIRO DO SUL;51170;P73264;COLÉGIO ESTADUAL JACOB ARNT
RS;4302808;CACAPAVA DO SUL;51324;P71528;IME PROF AUGUSTA MARIA DE LIMA MARQUES
RS;4303004;CACHOEIRA DO SUL;51287;P70423;ULBRA CACHOEIRA DO SUL
RS;4303103;CACHOEIRINHA;51213;P70789;CENTRO UNIVERSITÁRIO CESUCA
RS;4303509;CAMAQUA;51263;P70738;ESCOLA ESTADUAL DE ENSINO MÉDIO ANA CESAR
RS;4303905;CAMPO BOM;51303;P70631;E.E. DE ENSINO MÉDIO ILDEFONSO PINTO
RS;4304408;CANELA;51174;P73438;ESCOLA ESTADUAL DE ENSINO MÉDIO DANTON CORRÊA DA SILVA
RS;4304507;CANGUCU;51264;P71887;ESCOLA TÉCNICA ESTADUAL CANGUÇU
RS;4304606;CANOAS;51306;P68763;INSTITUTO ESTADUAL DE EDUCAÇÃO DR CARLOS CHAGAS
RS;4304606;CANOAS;51304;P71182;CENTRO UNIVERSITÁRIO RITTER DOS REIS UNIRITTER
RS;4304606;CANOAS;51305;P71182;CENTRO UNIVERSITÁRIO RITTER DOS REIS UNIRITTER
RS;4304630;CAPAO DA CANOA;51202;P72394;EEEM LUIZ MOSCHETTI
RS;4304663;CAPAO DO LEAO;51265;P72587;E.E.ENSINO MÉDIO PRESIDENTE CASTELO BRANCO
RS;4304705;CARAZINHO;51252;P70645;EEE BÁSICA ÉRICO VERÍSSIMO
RS;4304804;CARLOS BARBOSA;51175;P72666;E. E. E. M. ELISA TRAMONTINA
RS;4304903;CASCA;51214;P73592;UNIVERSIDADE DE PASSO FUNDO
RS;4305108;CAXIAS DO SUL;51177;P68154;ANHANGUERA EDUCACIONAL PARTICIPAÇÕES SA
RS;4305108;CAXIAS DO SUL;51179;P68154;ANHANGUERA EDUCACIONAL PARTICIPAÇÕES SA
RS;4305108;CAXIAS DO SUL;51176;P70546;CENTRO UNIVERSITÁRIO DA SERRA GAÚCHA - FSG
RS;4305108;CAXIAS DO SUL;51178;P70546;CENTRO UNIVERSITÁRIO DA SERRA GAÚCHA - FSG
RS;4305173;CERRO GRANDE DO SUL;51171;P73243;ESCOLA MUNICIPAL E.F. FORTALEZA
RS;4305207;CERRO LARGO;51284;P72758;UFFS - BLOCO A
RS;4305355;CHARQUEADAS;51215;P70800;IERGS CHARQUEADAS
RS;4305454;CIDREIRA;51216;P73236;EMEF MARCÍLIO DIAS
RS;4305900;CORONEL BICACO;51217;P73277;ESCOLA ESTADUAL DE ENSINO MÉDIO CECILIA MEIRELES
RS;4306007;CRISSIUMAL;51198;P71800;ESCOLA MUNICIPAL DE ENSINO FUNDAMENTAL BENNO BENDER
RS;4306056;CRISTAL;51172;P72303;COLÉGIO ESTADUAL BENTO GONÇALVES DA SILVA
RS;4306106;CRUZ ALTA;51192;P70788;ESCOLA ESTADUAL DE ENSINO MÉDIO DOM ANTÔNIO REIS
RS;4306403;DOIS IRMAOS;51307;P72195;ESCOLA ESTADUAL TÉCNICA AFFONSO WOLF
RS;4306601;DOM PEDRITO;51168;P71783;ESCOLA ESTADUAL DE ENSINO MÉDIO NOSSA SENHORA DO PATROCÍNIO
RS;4306767;ELDORADO DO SUL;51218;P71642;ESCOLA ESTADUAL DE ENSINO MÉDIO ELDORADO DO SUL
RS;4306809;ENCANTADO;51288;P73387;I. E.E.MONSENHOR SCALABRINI
RS;4306908;ENCRUZILHADA DO SUL;51289;P73220;EEEB BORGES DE MEDEIROS
RS;4307005;ERECHIM;51253;P70657;COLÉGIO ESTADUAL PROFESSOR MANTOVANI
RS;4307203;ERVAL GRANDE;51219;P73412;E.E.E.M ERVAL GRANDE
RS;4307302;ERVAL SECO;51187;P72475;CENTRO UNIVERSITÁRIO LEONARDO DA VINCI - UNIASSELVI
RS;4307500;ESPUMOSO;51254;P72600;ESCOLA ESTADUAL DE ENSINO MÉDIO JOSÉ CLEMENTE PEREIRA
RS;4307609;ESTANCIA VELHA;51308;P72576;EMEF GERMANO DAUERNHEIMER
RS;4307708;ESTEIO;51309;P71048;ETE BERNARDO VIEIRA DE MELLO
RS;4307807;ESTRELA;51220;P72521;ESCOLA ESTADUAL DE EDUCAÇÃO BÁSICA VIDAL DE NEGREIROS
RS;4307906;FARROUPILHA;51180;P70606;COLÉGIO ESTADUAL FARROUPILHA
RS;4308003;FAXINAL DO SOTURNO;51188;P71621;ESCOLA ESTADUAL DE ENSINO BÁSICO DOM ANTÔNIO REIS
RS;4308102;FELIZ;51189;P73713;ESCOLA MUNICIPAL DE ENSINO FUNDAMENTAL ALFREDO SPIER
RS;4308201;FLORES DA CUNHA;51190;P71750;ESCOLA ESTADUAL DE ENSINO FUNDAMENTAL HORÁCIO BORGHETTI
RS;4308300;FONTOURA XAVIER;51191;P71903;INSTITUTO ESTADUAL ERNESTO FERREIRA MAIA
RS;4308508;FREDERICO WESTPHALEN;51272;P71370;URI
RS;4308607;GARIBALDI;51181;P72593;FACULDADE FISUL
RS;4308904;GETULIO VARGAS;51255;P71384;INSTITUTO DE DESENVOLVIMENTO EDUCACIONAL DO ALTO URUGUAI - CAMPUS 2 - FACULDADE IDEAU
RS;4309100;GRAMADO;51163;P73661;ESCOLA MUNICIPAL DE ENSINO FUNDAMENTAL SENADOR SALGADO FILHO
RS;4309209;GRAVATAI;51221;P70586;ESCOLA ESTADUAL DE ENSINO MÉDIO MORADA DO VALE I
RS;4309308;GUAIBA;51222;P71269;INSTITUTO ESTADUAL DE EDUCAÇÃO GOMES JARDIM
RS;4309407;GUAPORE;51223;P73362;FUNDAÇÃO UNIVERSIDADE DE CAXIAS DO SUL - CAMPUS GUAPORÉ
RS;4309605;HORIZONTINA;51224;P71955;EMEF MONTEIRO LOBATO
RS;4310009;IBIRUBA;51199;P73408;INSTITUTO ESTADUAL DE EDUCAÇÃO EDMUNDO ROEWER
RS;4310108;IGREJINHA;51310;P70783;EMEF VILA NOVA
RS;4310207;IJUI;51193;P71692;FIDENE - UNIJUÍ - UNIVERSIDADE REGIONAL DO NOROESTE DO ESTADO DO RIO GRANDE DO SUL
RS;4310603;ITAQUI;51300;P71909;UNIPAMPA - UNIVERSIDADE FEDERAL DO PAMPA
RS;4310801;IVOTI;51311;P71603;ESCOLA ESTADUAL DE EDUCAÇÃO BASICA PROFESSOR MATHIAS SCHUTZ
RS;4311007;JAGUARAO;51266;P71529;EEEM HERMES PINTOS AFFONSO
RS;4311106;JAGUARI;51225;P73318;INSTITUTO ESTADUAL DE EDUCAÇÃO PROFESSOR GUILHERMINA JAVORSKI
RS;4311205;JULIO DE CASTILHOS;51325;P72542;EEEM DR JÚLIO PRATES DE CASTILHOS
RS;4311304;LAGOA VERMELHA;51256;P73610;UPF LAGOA VERMELHA
RS;4311403;LAJEADO;51290;P72876;UNIVATES
RS;4311700;MACHADINHO;51257;P73162;ESCOLA ESTADUAL DE ENSINO MÉDIO CASTRO ALVES
RS;4311809;MARAU;51258;P72973;FACULDADE CESURG MARAÚ
RS;4312401;MONTENEGRO;51312;P70298;COLÉGIO ESTADUAL DR. PAULO RIBEIRO CAMPOS
RS;4312500;MOSTARDAS;51226;P73727;E.M.F. DR. DINARTE SILVEIRA MARTINS
RS;4312658;NAO-ME-TOQUE;51195;P71634;INSTITUTO ESTADUAL DE EDUCAÇÃO SÃO FRANCISCO SOLANO
RS;4312708;NONOAI;51197;P74431;ESCOLA MUNICIPAL DE ENSINO FUNDAMENTAL JAIR DE MOURA CALIXTO
RS;4313037;NOVA ESPERANCA DO SUL;51227;P73355;COLÉGIO ESTADUAL JOSÉ BENINCA
RS;4313060;NOVA HARTZ;51228;P72718;EMEF PRIMAVERA
RS;4313201;NOVA PETROPOLIS;51182;P73462;COLÉGIO ESTADUAL PADRE WERNER
RS;4313300;NOVA PRATA;51183;P73322;ESCOLA ESTADUAL DE ENSINO MÉDIO ONZE DE AGOSTO
RS;4313375;NOVA SANTA RITA;51196;P72316;ESCOLA MUNICIPAL MIGUEL COUTO
RS;4313409;NOVO HAMBURGO;51313;P71084;UNIVERSIDADE FEEVALE
RS;4313409;NOVO HAMBURGO;51314;P71084;UNIVERSIDADE FEEVALE
RS;4313508;OSORIO;51203;P73377;EEEF CÔNEGO PEDRO JACOBS
RS;4313656;PALMARES DO SUL;51229;P73450;E.E.E.M. PROFESSOR ALBANO ALVES PEREIRA
RS;4313706;PALMEIRA DAS MISSOES;51273;P73487;UNIVERSIDADE FEDERAL DE SANTA MARIA UFSM CAMPUS PALMEIRA DAS MISSÕES
RS;4313805;PALMITINHO;51230;P73282;INSTITUTO ESTADUAL DE EDUCAÇÃO 22 DE MAIO
RS;4313904;PANAMBI;51194;P70528;ESCOLA ESTADUAL DE ENSINO MÉDIO PINDORAMA
RS;4314050;PAROBE;51315;P72732;EMEF ROMILDA SIBEL RENCK
RS;4314100;PASSO FUNDO;51259;P70433;FACULDADE ANHANGUERA DE PASSO FUNDO
RS;4314407;PELOTAS;51267;P70236;UNIVERSIDADE FEDERAL DE PELOTAS - CÂMPUS ANGLO
RS;4314407;PELOTAS;51268;P70236;UNIVERSIDADE FEDERAL DE PELOTAS - CÂMPUS ANGLO
RS;4314506;PINHEIRO MACHADO;51269;P73547;EMEF DOIS DE MAIO
RS;4314605;PIRATINI;51270;P73414;UNOPAR
RS;4314803;PORTAO;51316;P70699;ESCOLA TÉCNICA ESTADUAL PORTÃO
RS;4314902;PORTO ALEGRE;51235;P70315;UNIVERSIDADE FEDERAL DO RIO GRANDE DO SUL - PRÉDIO 11209 - CAMPUS CENTRO
RS;4314902;PORTO ALEGRE;51238;P70576;INSTITUTO EDUCACIONAL DO RIO GRANDE DO SUL  - IERGS - CENTRO HISTÓRICO
RS;4314902;PORTO ALEGRE;51239;P70860;UNISINOS - CAMPUS PORTO ALEGRE
RS;4314902;PORTO ALEGRE;51243;P70866;IERGS EDUCACIONAL ZONA NORTE LTDA
RS;4314902;PORTO ALEGRE;51233;P71204;COLÉGIO ESTADUAL PROFESSOR ELMANO LAUFFER LEAL
RS;4314902;PORTO ALEGRE;51231;P74205;COLÉGIO JOÃO XXIII
RS;4314902;PORTO ALEGRE;51237;P74217;COLÉGIO ESTADUAL INÁCIO MONTANHA
RS;4314902;PORTO ALEGRE;51236;P74223;COLÉGIO ESTADUAL PARANÁ
RS;4314902;PORTO ALEGRE;51244;P74225;EEEM INFANTE DOM HENRIQUE
RS;4314902;PORTO ALEGRE;51232;P74228;ESCOLA TÉCNICA ESTADUAL IRMÃO PEDRO
RS;4314902;PORTO ALEGRE;51234;P74235;ESCOLA ESTADUAL ENSINO FUNDAMENTAL DOUTOR PACHECO PRATES
RS;4314902;PORTO ALEGRE;51242;P74246;ESCOLA ESTADUAL DE ENSINO FUNDAMENTAL PROFESSOR LEOPOLDO TIETBOHL
RS;4314902;PORTO ALEGRE;51240;P74247;FACTUM - FACULDADE E ESCOLA TÉCNICA
RS;4314902;PORTO ALEGRE;51245;P74253;EEEF MINISTRO SALGADO FILHO
RS;4314902;PORTO ALEGRE;51241;P74311;COLÉGIO ESTADUAL PROTÁSIO ALVES
RS;4315107;PORTO XAVIER;51275;P71307;INSTITUTO ESTADUAL DE EDUCAÇÃO SÃO FRANCISCO XAVIER
RS;4315305;QUARAI;51342;P73233;POLO UAB DE QUARAÍ
RS;4315404;REDENTORA;51276;P73507;UNOPAR
RS;4315503;RESTINGA SECA;51277;P73149;POLO EDUCACIONAL DE ENSINO SUPERIOR DE RESTING SÊCA
RS;4315602;RIO GRANDE;51278;P70328;UNIVERSIDADE FEDERAL DO RIO GRANDE - FURG
RS;4315701;RIO PARDO;51291;P71266;ESCOLA ESTADUAL DE ENSINO MÉDIO FORTALEZA
RS;4316006;ROLANTE;51246;P72351;ESCOLA ESTADUAL DE EDUCAÇÃO BÁSICA COMENDADOR ALBINO SOUZA CRUZ
RS;4316402;ROSARIO DO SUL;51280;P72272;ESCOLA DE ENSINO MÉDIO ENSIDUC
RS;4316451;SALTO DO JACUI;51283;P71345;EEEM CASTELO BRANCO
RS;4316600;SANANDUVA;51200;P73043;UNIVERSIDADE ESTADUAL DO RIO GRANDE DO SUL - UERGS
RS;4316808;SANTA CRUZ DO SUL;51292;P70760;COLÉGIO ESTADUAL PROFESSOR LUIZ DOURADO
RS;4316808;SANTA CRUZ DO SUL;51293;P71413;UNISC - UNIVERSIDADE DE SANTA CRUZ DO SUL
RS;4316907;SANTA MARIA;51326;P70232;COLÉGIO ESTADUAL MANOEL RIBAS
RS;4316907;SANTA MARIA;51328;P70771;ESCOLA ESTADUAL DE ENSINO FUNDAMENTAL JOÃO BELÉM
RS;4316907;SANTA MARIA;51327;P71741;EEEB PROFESSORA MARGARIDA LOPES
RS;4317103;SANTANA DO LIVRAMENTO;51281;P70761;E.E.EF. VITELLIO GAZAPINA
RS;4317202;SANTA ROSA;51332;P73545;FIDENE UNIJUÍ - CAMPUS SANTA ROSA - RS
RS;4317301;SANTA VITORIA DO PALMAR;51336;P72899;COLÉGIO ESTADUAL SANTA VITÓRIA DO PALMAR
RS;4317400;SANTIAGO;51335;P71894;URI CAMPUS SANTIAGO
RS;4317509;SANTO ANGELO;51285;P73417;EEEM DOUTOR AUGUSTO DO NASCIMENTO E SILVA
RS;4317608;SANTO ANTONIO DA PATRULHA;51204;P70754;ESCOLA ESTADUAL DE ENSINO MÉDIO PROFESSOR CÂNDIDO DE BARROS
RS;4317806;SANTO AUGUSTO;51201;P73383;ESCOLA ESTADUAL DE ENSINO MÉDIO SENADOR ALBERTO PASQUALINI
RS;4317905;SANTO CRISTO;51247;P73454;NÚCLEO ESTADUAL DE EDUCAÇÃO DE JOVENS E ADULTOS E DE CULTURA POPULAR PAULO FREIRE
RS;4318002;SAO BORJA;51301;P71687;COLÉGIO ESTADUAL DE SÃO BORJA
RS;4318101;SAO FRANCISCO DE ASSIS;51298;P73320;INSTITUTO ESTADUAL DE EDUCAÇÃO SALGADO FILHO
RS;4318200;SAO FRANCISCO DE PAULA;51299;P73406;UAB CENTRO DE APOIO PARA EDUCAÇÃO A DISTÂNCIA DE SÃO FRANCISCO DE PAULA
RS;4318309;SAO GABRIEL;51282;P70594;IEE MENNA BARRETO
RS;4318408;SAO JERONIMO;51248;P72116;UNIVERSIDADE LUTERANA DO BRASIL
RS;4318507;SAO JOSE DO NORTE;51302;P72294;EMEF JOÃO DE DEUS COLLARES CAIC
RS;4318705;SAO LEOPOLDO;51317;P68591;ESCOLA MUNICIPAL DE ENSINO FUNDAMENTAL PROFESSORA OTÍLIA CARVALHO RIETH
RS;4318705;SAO LEOPOLDO;51318;P73386;ESCOLA TÉCNICA ESTADUAL FREDERICO GUILHERME SCHMIDT
RS;4318705;SAO LEOPOLDO;51319;P73396;EMEF PROFESSORA MARIA GUSMÃO BRITTO
RS;4318804;SAO LOURENCO DO SUL;51271;P72573;POLO DE APOIO AO ENSINO A DISTÂNCIA (EMEF PROF. MARINA VARGAS)
RS;4318903;SAO LUIZ GONZAGA;51286;P73424;URI - SÃO LUIZ GONZAGA
RS;4319000;SAO MARCOS;51184;P73191;COLÉGIO ESTADUAL SÃO MARCOS
RS;4319307;SAO PAULO DAS MISSOES;51330;P73272;ESCOLA ESTADUAL DE EDUCAÇÃO BÁSICA PROFESSOR FRANCISCO JOSÉ DAMKE
RS;4319406;SAO PEDRO DO SUL;51331;P73575;ESCOLA ESTADUAL DE EDUAÇÃO BÁSICA TITO FERRARI
RS;4319505;SAO SEBASTIAO DO CAI;51334;P70911;ESCOLA MUNICIPAL SÃO JOSÉ
RS;4319802;SAO VICENTE DO SUL;51329;P73580;INSTITUTO FEDERAL FARROUPILHA - CAMPUS SÃO VICENTE
RS;4319901;SAPIRANGA;51320;P73614;EMEF SÃO CARLOS
RS;4320008;SAPUCAIA DO SUL;51321;P71161;ESCOLA ESTADUAL DE ENSINO FUNDAMENTAL SAPUCAIA DO SUL
RS;4320107;SARANDI;51260;P70895;ESCOLA ESTADUAL DE ENSINO FUNDAMENTAL DOM JOSÉ COUTINHO
RS;4320404;SERAFINA CORREA;51297;P71946;COLÉGIO ESTADUAL CARNEIRO DE CAMPOS
RS;4320552;SERTAO SANTANA;51249;P72919;ESCOLA ESTADUAL DE ENSINO MÉDIO COMENDADOR EDUARDO SECCO
RS;4320701;SOBRADINHO;51294;P71971;POLO REGIONAL DE ENSINO SUPERIOR A DISTÂNCIA DE SOBRADINHO
RS;4320800;SOLEDADE;51261;P73588;UPF SOLEDADE
RS;4320909;TAPEJARA;51262;P72553;FAT FACULDADE E ESCOLA
RS;4321006;TAPERA;51337;P73582;ESCOLA ESTADUAL ENSINO MÉDIO DIONÍSIO LOTHÁRIO CHOSSAT
RS;4321105;TAPES;51339;P73461;UNIASSELVI - POLO TAPES
RS;4321204;TAQUARA;51322;P72101;FACCAT
RS;4321303;TAQUARI;51323;P71414;E E E M BARÃO DE IBICUÍ
RS;4321402;TENENTE PORTELA;51338;P73696;EMEF ARCELINO SOARES BUENO
RS;4321451;TEUTONIA;51295;P71873;EEEM REYNALDO AFFONSO AUGUSTIN
RS;4321501;TORRES;51205;P71154;ULBRA TORRES
RS;4321600;TRAMANDAI;51206;P73204;E. E. E. F ALMIRANTE TAMANDARÉ
RS;4321709;TRES COROAS;51340;P73531;ESCOLA MUNICIPAL DE ENSINO FUNDAMENTAL BALDUÍNO ROBINSON
RS;4321808;TRES DE MAIO;51333;P70958;SOCIEDADE EDUCACIONAL TRÊS DE MAIO - SETREM
RS;4321907;TRES PASSOS;51274;P73738;POLO UNIVERSITÁRIO FEDERAL DE TRÊS PASSOS
RS;4321956;TRINDADE DO SUL;51250;P73570;ESC. EST. ENS. MÉD. ZENIR GHIZZI DA SILVA
RS;4322004;TRIUNFO;51341;P73200;IERGS - INSTITUTO EDUCACIONAL DO RIO GRANDE DO SUL
RS;4322400;URUGUAIANA;51343;P70402;INSTITUTO ESTADUAL ROMAGUERA CORRÊA
RS;4322509;VACARIA;51185;P70394;EEEM PADRE EFREM
RS;4322608;VENANCIO AIRES;51296;P70734;E.E.E.MÉDIO CÔNEGO ALBINO JUCHEM
RS;4322806;VERANOPOLIS;51186;P73231;COLÉGIO ESTADUAL SÃO LUIZ GONZAGA
RS;4323002;VIAMAO;51251;P71453;INSTITUTO ESTADUAL DE EDUCAÇÃO ISABEL DE ESPANHA
SC;4200101;ABELARDO LUZ;51045;P72270;E.E.F ALTAIR SILVA
SC;4200200;AGROLANDIA;51046;P71795;EEB PEDRO AMÉRICO
SC;4201307;ARAQUARI;51116;P71346;EEM. SENADOR LUIZ HENRIQUE DA SILVEIRA
SC;4201406;ARARANGUA;51047;P73114;UFSC - UNIVERSIDADE FEDERAL DE SANTA CATARINA - CAMPUS ARARANGUÁ
SC;4201505;ARMAZEM;51048;P72343;EEB MONSENHOR FRANCISCO GIESBERTS
SC;4202008;BALNEARIO CAMBORIU;51093;P73078;E.E.B. PRESIDENTE JOÃO GOULART
SC;4202107;BARRA VELHA;51104;P72780;EEB CONSELHEIRO ASTROGILDO ODON AGUIAR
SC;4202305;BIGUACU;51148;P73234;E.E.M. PROFª Mª DA GLÓRIA V. DE FARIA
SC;4202404;BLUMENAU;51050;P68893;UNIVERSIDADE REGIONAL DE BLUMENAU - FURB - CAMPUS I
SC;4202404;BLUMENAU;51051;P68893;UNIVERSIDADE REGIONAL DE BLUMENAU - FURB - CAMPUS I
SC;4202453;BOMBINHAS;51078;P72949;EEB MARIA RITA FLOR
SC;4202800;BRACO DO NORTE;51157;P72530;ESCOLA DE EDUCAÇÃO BÁSICA DOM JOAQUIM
SC;4202909;BRUSQUE;51094;P73651;UNIFEBE - CENTRO UNIVERSITÁRIO DE BRUSQUE
SC;4203006;CACADOR;51064;P70867;ESCOLA JOVEM DE ENSINO MÉDIO IRMÃO LEO
SC;4203105;CAIBI;51054;P71784;EEB DOM PEDRO II
SC;4203204;CAMBORIU;51095;P73009;E.B.M. PROFª CLOTILDE RAMOS CHAVES
SC;4203501;CAMPO ERE;51055;P73368;ESCOLA DE EDUCAÇÃO BÁSICA EMÍLIO GARRASTAZÚ MÉDICI
SC;4203600;CAMPOS NOVOS;51109;P72978;ESCOLA DE EDUCAÇÃO BÁSICA PAULO BLASI
SC;4203808;CANOINHAS;51070;P73259;ESCOLA DE EDUCAÇÃO BÁSICA JOÃO JOSÉ DE SOUZA CABRAL
SC;4203907;CAPINZAL;51114;P73440;ESCOLA MUNICIPAL BELSÁRIO PENA
SC;4203956;CAPIVARI DE BAIXO;51161;P71591;UNIVINTE
SC;4204202;CHAPECO;51056;P68881;UNOESC
SC;4204202;CHAPECO;51057;P68881;UNOESC
SC;4204301;CONCORDIA;51062;P73142;EEB SÃO JOÃO BATISTA DE LA SALLE
SC;4204608;CRICIUMA;51072;P70322;UNESC - UNIVERSIDADE COMUNITÁRIA
SC;4204608;CRICIUMA;51073;P70322;UNESC - UNIVERSIDADE COMUNITÁRIA
SC;4204608;CRICIUMA;51074;P70322;UNESC - UNIVERSIDADE COMUNITÁRIA
SC;4204707;CUNHA PORA;51079;P72703;ESCOLA DE EDUCAÇÃO BÁSICA PROFESSOR PATRICIO JOÃO DE OLIVEIRA
SC;4204806;CURITIBANOS;51065;P73205;EEB SOLON ROSA
SC;4205001;DIONISIO CERQUEIRA;51143;P71842;EEB DR THEODURETO CARLOS DE FARIA SOUTO
SC;4205407;FLORIANOPOLIS;51081;P70172;UDESC - UNIVERSIDADE DO ESTADO DE SANTA CATARINA - FAED
SC;4205407;FLORIANOPOLIS;51082;P70235;UNIVERSIDADE FEDERAL DE SANTA CATARINA (UFSC) - CTC
SC;4205407;FLORIANOPOLIS;51080;P71138;UNIVERSIDADE FEDERAL DE SANTA CATARINA - UFSC - CFH
SC;4205456;FORQUILHINHA;51091;P73133;ESCOLA DE EDUCAÇÃO BÁSICA LUIZ TRAMONTIM
SC;4205506;FRAIBURGO;51066;P73504;UNIVERSIDADE DO ALTO VALE DO RIO DO PEIXE
SC;4205704;GAROPABA;51149;P71805;EEB PROF. JOSÉ RODRIGUES LOPES
SC;4205803;GARUVA;51092;P72075;ESCOLA MUNICIPAL VICENTE VIEIRA
SC;4205902;GASPAR;51049;P72295;EEB ARNOLDO AGENOR ZIMMERMANN
SC;4206504;GUARAMIRIM;51111;P72506;CENTRO UNIVERSITÁRIO UNIASSELVI DE GUARAMIRIM
SC;4206702;HERVAL DOESTE;51115;P73512;CENTRO DE EDUCAÇÃO DE JOVENS E ADULTOS - CEJA
SC;4206900;IBIRAMA;51134;P73297;UNIVERSIDADE DO ESTADO DE SANTA CATARINA - UDESC
SC;4207007;ICARA;51075;P71701;EEB PROF. SALETE SCOTTI DOS SANTOS
SC;4207304;IMBITUBA;51158;P71173;EEB JOÃO GUIMARÃES CABRAL
SC;4207502;INDAIAL;51052;P71292;EEB FREDERICO HARDT
SC;4207650;IPORA DO OESTE;51101;P73505;FACULDADE FAEL IPORÃ DO OESTE
SC;4207700;IPUMIRIM;51102;P72748;EEB BENJAMIM CARVALHO DE OLIVEIRA
SC;4207809;IRANI;51103;P71511;ESCOLA BÁSICA MUNICIPAL SEBASTIÃO RODRIGUES DE SOUSA
SC;4208104;ITAIOPOLIS;51107;P72434;ESCOLA MUNICIPAL CENTRO EDUCATIVO ITAIOPOLIS
SC;4208203;ITAJAI;51096;P70445;UNIVALI - UNIVERSIDADE DO VALE DO ITAJAÍ
SC;4208203;ITAJAI;51097;P70445;UNIVALI - UNIVERSIDADE DO VALE DO ITAJAÍ
SC;4208302;ITAPEMA;51098;P71523;EMEB EDUCAR
SC;4208401;ITAPIRANGA;51144;P73506;UCEFF
SC;4208450;ITAPOA;51100;P72632;EEB NEREU RAMOS
