SG_UF_PROVA;CO_MUNICIPIO_PROVA;NO_MUNICIPIO_PROVA;CO_COORDENACAO;CO_LOCAL;NO_LOCAL_PROVA
PE;2601607;BELEM DO SAO FRANCISCO;50543;P72071;ETE MARIA EMILIA CANTARELLI
PE;2601706;BELO JARDIM;50487;P74762;ESCOLA FREI CASSIANO COMACCHIO
PE;2601904;BEZERROS;50492;P71534;EREM PROFESSORA MARIA ANA
PE;2602308;BONITO;50493;P71267;ESCOLA TÉCNICA ESTADUAL CÉLIA DE SOUZA LEÃO ARRAES DE ALENCAR
PE;2602902;CABO DE SANTO AGOSTINHO;50523;P70487;ETE ESCOLA TÉCNICA ESTADUAL EPITACIO PESSOA
PE;2602902;CABO DE SANTO AGOSTINHO;50522;P70491;ESCOLA ESTADUAL MADRE IVA BEZERRA DE ARAÚJO
PE;2603454;CAMARAGIBE;50524;P72525;ESCOLA ESTADUAL PIO XII
PE;2604007;CARPINA;50525;P70772;ESCOLA DE REFERÊNCIA EM ENSINO MÉDIO JOAQUIM OLAVO
PE;2604106;CARUARU;50495;P70525;CENTRO UNIVERSITÁRIO UNIFAVIP WYDEN
PE;2604106;CARUARU;50494;P71929;ESCOLA TÉCNICA ESTADUAL NELSON BARBALHO
PE;2605103;CUSTODIA;50488;P71094;EREFEM GENERAL JOAQUIM INÁCIO
PE;2605152;DORMENTES;50503;P71942;ESCOLA MAURÍCIO JOSÉ ROLIM CAVALCANTI
PE;2605202;ESCADA;50526;P71380;ESCOLA MUNICIPAL MONTE SINAI
PE;2605301;EXU;50544;P71233;ESCOLA DE REFERÊNCIA EM ENSINO MÉDIO BARÃO DE EXU
PE;2606002;GARANHUNS;50499;P70526;UNIVERSIDADE FEDERAL DO AGRESTE DE PERNAMBUCO - UFAPE
PE;2606200;GOIANA;50527;P70547;ETE ADERICO ALVES DE VASCONCELOS
PE;2606408;GRAVATA;50528;P72665;ESCOLA ESTADUAL AARÃO LINS DE ANDRADE
PE;2606804;IGARASSU;50529;P71271;EREM SANTOS COSME E DAMIÃO
PE;2607000;INAJA;50530;P72591;ESCOLA MUNICIPAL MARIA DE JESUS
PE;2607208;IPOJUCA;50531;P71505;ESCOLA ESTADUAL ANIBAL CARDOSO
PE;2607604;ILHA DE ITAMARACA;50509;P71280;EREM ALBERTO AUGUSTO MORAIS PRADINES
PE;2607901;JABOATAO DOS GUARARAPES;50532;P70706;UNIFG
PE;2608800;LAJEDO;50500;P72486;ETE ANTÔNIO DOURADO CAVALCANTI
PE;2608909;LIMOEIRO;50535;P71210;COLÉGIO SANTA MÔNICA
PE;2609501;NAZARE DA MATA;50537;P72281;ESCOLA DE REFERÊNCIA EM ENSINO MÉDIO DON VIEIRA
PE;2609600;OLINDA;50538;P70767;UNINOVO - CENTRO UNIVERSITÁRIO
PE;2609907;OURICURI;50545;P71604;INSTITUTO FEDERAL DO SERTÃO PERNAMBUCANO - CAMPUS OURICURI
PE;2610004;PALMARES;50539;P71526;COLÉGIO MUNICIPAL FERNANDO AUGUSTO PINTO RIBEIRO
PE;2610707;PAULISTA;50533;P70346;EREM PROFA AMARINA SIMÕES
PE;2610707;PAULISTA;50534;P70350;EREM DANTAS BARRETO
PE;2610905;PESQUEIRA;50489;P71137;EREM JOSÉ DE ALMEIDA MACIEL
PE;2611002;PETROLANDIA;50490;P71351;EE EREM DE JATOBÁ
PE;2611101;PETROLINA;50504;P70502;UNIVASF-UNIVERSIDADE FEDERAL DO VALE DO SÃO FRANCISCO
PE;2611101;PETROLINA;50505;P71024;UNINASSAU PETROLINA
PE;2611606;RECIFE;50514;P67645;CENTRO UNIVERSITÁRIO UNIFBV
PE;2611606;RECIFE;50516;P67645;CENTRO UNIVERSITÁRIO UNIFBV
PE;2611606;RECIFE;50519;P67645;CENTRO UNIVERSITÁRIO UNIFBV
PE;2611606;RECIFE;50513;P68883;FACULDADE ESTÁCIO DE SÁ DO RECIFE - CAMPUS ABDIAS DE CARVALHO
PE;2611606;RECIFE;50515;P70685;CENTRO DE CIÊNCIAS SOCIAIS APLICADAS - CCSA UFPE
PE;2611606;RECIFE;50510;P70753;FACULDADE DE CIÊNCIAS HUMANAS - ESUDA
PE;2611606;RECIFE;50511;P70753;FACULDADE DE CIÊNCIAS HUMANAS - ESUDA
PE;2611606;RECIFE;50517;P70770;CENTRO DE CIÊNCIAS EXATAS DA NATUREZA - CCEN ÁREA II - UFPE
PE;2611606;RECIFE;50518;P71422;UFPE - NIATE CCEN/CTG
PE;2611606;RECIFE;50512;P71433;UFPE - NIATE CFCH/CCSA
PE;2612208;SALGUEIRO;50546;P70646;ESCOLA DE REFERÊNCIA EM ENSINO FUNDAMENTAL PROFESSORA MARIA DA CONCEIÇÃO CISNEIROS SAMPAIO
PE;2612505;SANTA CRUZ DO CAPIBARIBE;50496;P72944;ESCOLA DE REFERÊNCIA EM ENSINO MÉDIO PADRE ZUZINHA
PE;2613008;SAO BENTO DO UNA;50501;P71438;ESCOLA MUNICIPAL MÔNICA CRISTINA DA SILVA BRAGA
PE;2613404;SAO JOSE DA COROA GRANDE;50520;P71519;EREM PROFESSOR CARLOS JOSÉ DIAS DA SILVA
PE;2613503;SAO JOSE DO BELMONTE;50547;P71559;ESCOLA TÉCNICA ESTADUAL PEDRO LEÃO LEAL
PE;2613602;SAO JOSE DO EGITO;50491;P72607;FACULDADE VALE DO PAJEÚ
PE;2613701;SAO LOURENCO DA MATA;50521;P72673;ETE - ESCOLA TÉCNICA ESTADUAL GOVERNADOR EDUARDO CAMPOS
PE;2613909;SERRA TALHADA;50548;P70342;FAMA FACULDADES AGGEU MAGALHÃES
PE;2614501;SURUBIM;50497;P71657;POLO UAB SURUBIM
PE;2615300;TIMBAUBA;50536;P71259;FACULDADE DE CIÊNCIAS DE TIMBAÚBA
PE;2615607;TRINDADE;50540;P72917;EREM GOVERNADOR MUNIZ FALCÃO
PE;2616407;VITORIA DE SANTO ANTAO;50541;P70572;EREM SENADOR JOÃO CLEOFAS DE OLIVEIRA
PI;2200202;AGUA BRANCA;50148;P72826;UNIVERSIDADE ABERTA DO BRASIL - (UAB)
PI;2200400;ALTOS;50149;P72962;UNIDADE ESCOLAR JOÃO DE PAIVA OLIVEIRA
PI;2200608;ANGICAL DO PIAUI;50150;P72742;CETI-DEMERVAL LOBÃO
PI;2201200;BARRAS;50151;P71532;UNIVERSIDADE ESTADUAL NÚCLEO RIO MARATAOAN - UESPI
PI;2201903;BOM JESUS;50138;P71139;UNIVERSIDADE FEDERAL DO PIAUÍ- CAMPUS PROFª. CINOBELINA ELVAS
PI;2202208;CAMPO MAIOR;50152;P71935;C. E. T. I. RAIMUNDINHO ANDRADE
PI;2202307;CANTO DO BURITI;50139;P71315;CETI BEIJA VALENTE
PI;2202604;CASTELO DO PIAUI;50153;P72258;POLO DE APOIO PRESENCIAL TERRITÓRIO DOS CARNAUBAIS - EAD UAB CASTELO
PI;2202901;CORRENTE;50140;P72160;FACULDADE DO CERRADO PIAUIENSE - FCP
PI;2203701;ESPERANTINA;50154;P72843;CETI JOSÉ NOGUEIRA DE AGUIAR
PI;2203909;FLORIANO;50141;P72701;UFPI
PI;2205003;ITAINOPOLIS;50158;P73196;UNIDADE ESCOLAR ÁLVARO RODRIGUES DE ARAÚJO
PI;2205508;JOSE DE FREITAS;50155;P72828;ESCOLA MUNICIPAL AGRIPINA PORTELA
PI;2207009;OEIRAS;50142;P71844;UNIVERSIDADE ESTADUAL DO PIAUÍ (UESPI) - CAMPUS PROFESSOR POSSIDÔNIO QUEIROZ
PI;2207702;PARNAIBA;50164;P68399;UNIVERSIDADE FEDERAL DO DELTA DO PARNAÍBA - UFDPAR
PI;2207801;PAULISTANA;50143;P71224;CETI LUCINETE SANTANA DA SILVA
PI;2207900;PEDRO II;50157;P72723;CENTRO ESTADUAL DE TEMPO INTEGRAL PROFESSORA ANGELINA MENDES BRAGA
PI;2208007;PICOS;50144;P70386;UNIVERSIDADE FEDERAL DO PIAUÍ UFPI -  CAMPUS SENADOR HELVÍDIO NUNES DE BARROS
PI;2208304;PIRACURUCA;50156;P72126;POLO UAB PIRACURUCA TERRITÓRIO DOS COCAIS
PI;2208403;PIRIPIRI;50165;P70797;UNIDADE ESCOLAR BAURÉLIO MANGABEIRA
PI;2210003;SAO JOAO DO PIAUI;50145;P71362;INSTITUTO FEDERAL DO PIAUÍ- CAMPUS SÃO JOÃO DO PIAUÍ
PI;2210607;SAO RAIMUNDO NONATO;50146;P72934;CENTRO ESTADUAL DE TEMPO INTEGRAL GERCÍLIO DE CASTRO MACÊDO
PI;2211001;TERESINA;50159;P67894;UNIFSA - CENTRO UNIVERSITÁRIO SANTO AGOSTINHO - PRÉDIO II
PI;2211001;TERESINA;50161;P67894;UNIFSA - CENTRO UNIVERSITÁRIO SANTO AGOSTINHO - PRÉDIO II
PI;2211001;TERESINA;50160;P67907;UNIFSA - CENTRO UNIVERSITÁRIO SANTO AGOSTINHO - PRÉDIO SEDE
PI;2211001;TERESINA;50162;P67907;UNIFSA - CENTRO UNIVERSITÁRIO SANTO AGOSTINHO - PRÉDIO SEDE
PI;2211100;UNIAO;50166;P72773;POLO DE APOIO PRESENCIAL DA UAB DE UNIÃO
PI;2211209;URUCUI;50147;P71510;UNIDADE ESCOLAR ARICA LEAL
PI;2211407;VARZEA GRANDE;50163;P73136;CETI MARIA CÂNDIDA
PR;4100400;ALMIRANTE TAMANDARE;50925;P72469;CEEBJA AYRTON SENNA DA SILVA
PR;4100509;ALTONIA;51037;P72456;ESCOLA MUNICIPAL PROFESSOR RUBENS TESSARO
PR;4100608;ALTO PARANA;50926;P72696;ESCOLA ESTADUAL CÍVICO MILITAR AGOSTINHO STEFANELLO
PR;4101002;AMPERE;50891;P73303;FACULDADE DE AMPÉRE - FAMPER
PR;4101051;ANAHY;50927;P72771;ESCOLA MUNICIPAL VINÍCIUS DE MORAES
PR;4101101;ANDIRA;51001;P72804;APMF DA ESC. MUN. PINGO DE GENTE EDUCACAO INFANTIL E ENSINO FUNDAMENTAL
PR;4101200;ANTONINA;50920;P72150;CEEP DR. BRASÍLIO MACHADO
PR;4101408;APUCARANA;50842;P70817;FAP - FACULDADE DE APUCARANA
PR;4101507;ARAPONGAS;50845;P74285;COLÉGIO ESTADUAL CÍVICO MILITAR MARQUÊS DE CARAVELAS
PR;4101606;ARAPOTI;51017;P72288;CERB- COLÉGIO ESTADUAL RUI BARBOSA
PR;4101705;ARARUNA;50928;P72482;BIT PROFISSÕES E CENTRO UNIVERSITÁRIO INTEGRADO EAD
PR;4101804;ARAUCARIA;50929;P71076;COLÉGIO ESTADUAL JÚLIO SZYMANSKI
PR;4101903;ASSAI;50851;P72495;CENTRO ESTADUAL DE EDUCAÇÃO PROFISSIONAL PROFESSORA MARIA LYDIA CESCATTO BOMTEMPO
PR;4102000;ASSIS CHATEAUBRIAND;50872;P72408;INSTITUTO FEDERAL DO PARANÁ - CAMPUS ASSIS CHATEAUBRIAND
PR;4102109;ASTORGA;50846;P72528;INSTITUTO FEDERAL DO PARANÁ CAMPUS ASTORGA
PR;4102406;BANDEIRANTES;50852;P72315;UNIVERSIDADE ESTADUAL DO NORTE DO PARANÁ - CAMPUS LUIZ MENEGHEL
PR;4102505;BARBOSA FERRAZ;50994;P72292;COLÉGIO DOM BOSCO - EIEFM
PR;4102604;BARRACAO;51031;P72296;INSTITUTO FEDERAL DO PARANÁ – IFPR – CAMPUS BARRACÃO
PR;4102802;BELA VISTA DO PARAISO;50930;P73343;POLO FREDERICO OSAKU LEITE
PR;4102901;BITURUNA;50899;P72802;ESCOLA FREI TIAGO LUCHESE - POLO UAB DE BITURUNA
PR;4103107;BOCAIUVA DO SUL;50931;P72922;COLÉGIO ESTADUAL CARLOS ALBERTO RIBEIRO
PR;4103206;BOM SUCESSO;50932;P72524;ESCOLA MUNICIPAL PROFESSOR JOÃO TEIXEIRA MARABOLIN
PR;4103305;BORRAZOPOLIS;50900;P72747;ESCOLA PASSO PARA O FUTURO
PR;4103453;CAFELANDIA;50873;P72344;COLÉGIO ESTADUAL ALBERTO SANTOS DUMONT
PR;4103602;CAMBARA;50924;P72327;CECM DR GENEROSO MARQUES- EFM
PR;4103701;CAMBE;50856;P72768;COLÉGIO ESTADUAL OLAVO BILAC - EFMNF
PR;4103909;CAMPINA DA LAGOA;50998;P72860;UNICESUMAR CAMPINA DA LAGOA
PR;4104006;CAMPINA GRANDE DO SUL;50933;P72492;COLÉGIO ESTADUAL BANDEIRANTES
PR;4104204;CAMPO LARGO;50934;P72334;COLÉGIO ESTADUAL DESEMBARGADOR CLOTÁRIO PORTUGAL
PR;4104253;CAMPO MAGRO;50935;P73003;COLÉGIO ESTADUAL PROFESSORA IRIA BORGES DE MACEDO
PR;4104303;CAMPO MOURAO;50849;P71060;CEI- CENTRO EDUCACIONAL INTEGRADO
PR;4104428;CANDOI;50901;P72617;ESCOLA MUNICIPAL PROFESSORA TEREZA STAVNY DA SILVA EIEF
PR;4104501;CAPANEMA;50874;P72086;INSTITUTO FEDERAL DO PARANÁ- CAMPUS CAPANEMA
PR;4104600;CAPITAO LEONIDAS MARQUES;51002;P72505;ESCOLA MUNICIPAL TEREZINHA MACHADO
PR;4104659;CARAMBEI;50936;P72760;ESCOLA ELO SAGRADO
PR;4104709;CARLOPOLIS;51004;P72360;CENTRO UNIVERSITÁRIO INTERNACIONAL UNINTER
PR;4104808;CASCAVEL;50875;P70243;FAG CENTRO UNIVERSITÁRIO DA FUNDAÇÃO ASSIS GURGACZ
PR;4104808;CASCAVEL;50876;P70243;FAG CENTRO UNIVERSITÁRIO DA FUNDAÇÃO ASSIS GURGACZ
PR;4104907;CASTRO;51018;P71058;CE PROFESSORA MARIA APARECIDA NISGOSKI
PR;4105003;CATANDUVAS;50937;P72383;ESCOLA MUNICIPAL TIRADENTES
PR;4105409;CHOPINZINHO;50892;P72273;UNICENTRO - UNIVERSIDADE ESTADUAL DO CENTRO OESTE
PR;4105508;CIANORTE;50848;P71069;UNIPAR
PR;4105607;CIDADE GAUCHA;51038;P72489;POLO UAB DE CIDADE GAÚCHA
PR;4105706;CLEVELANDIA;50938;P72363;FACULDADE MUNICIPAL DE EDCUAÇÃO E MEIO AMBIENTE - FAMA
PR;4105805;COLOMBO;50939;P71881;INSTITUTO FEDERAL DO PARANA
PR;4105904;COLORADO;50847;P72461;ESCOLA MUNICIPAL PAULO FREIRE
PR;4106001;CONGONHINHAS;50902;P72034;POLO UAB CONGONHINHAS
PR;4106308;CORBELIA;50997;P72404;COLÉGIO ESTADUAL DUQUE DE CAXIAS
PR;4106407;CORNELIO PROCOPIO;50853;P70821;UNIVERSIDADE ESTADUAL DO NORTE DO PARANÁ
PR;4106456;CORONEL DOMINGOS SOARES;50903;P72424;UNIFECAF
PR;4106506;CORONEL VIVIDA;50893;P72159;COLÉGIO ESTADUAL ARNALDO BUSATO
PR;4106555;CORUMBATAI DO SUL;50940;P72619;ESCOLA MUNICIPAL CECILIA MEIRELES ENSINO FUNDAMENTAL
PR;4106605;CRUZEIRO DO OESTE;51039;P74288;COLÉGIO ESTADUAL CÍVICO MILITAR CRUZEIRO DO OESTE
PR;4106704;CRUZEIRO DO SUL;50941;P72322;ESCOLA MUNICIPAL PROF. FLÁVIO SARRÃO
PR;4106902;CURITIBA;50946;P72166;GRAN FACULDADE
PR;4106902;CURITIBA;50950;P72691;(UFPR) - SETOR DE CIÊNCIAS SOCIAIS APLICADAS
PR;4106902;CURITIBA;50953;P72691;(UFPR) - SETOR DE CIÊNCIAS SOCIAIS APLICADAS
PR;4106902;CURITIBA;50951;P72729;(UFPR) - SETOR DE CIÊNCIAS AGRÁRIAS
PR;4106902;CURITIBA;50947;P72785;UFPR -  SETOR DE CIÊNCIAS EXATAS - CENTRO POLITÉCNICO
PR;4106902;CURITIBA;50952;P72953;(UFPR) - SETOR DE CIÊNCIAS DA SAÚDE - SEDE BOTÂNICO
PR;4106902;CURITIBA;50949;P72954;(UFPR) - SETOR DE CIÊNCIAS DA SAÚDE - BLOCO DIDATICO II
PR;4106902;CURITIBA;50942;P73096;UNIVERSIDADE TUIUTI DO PARANÁ
PR;4106902;CURITIBA;50943;P73096;UNIVERSIDADE TUIUTI DO PARANÁ
PR;4106902;CURITIBA;50944;P73096;UNIVERSIDADE TUIUTI DO PARANÁ
PR;4106902;CURITIBA;50945;P73096;UNIVERSIDADE TUIUTI DO PARANÁ
PR;4106902;CURITIBA;50948;P73096;UNIVERSIDADE TUIUTI DO PARANÁ
PR;4107207;DOIS VIZINHOS;50894;P72622;COLÉGIO CÍVICO MILITAR LEONARDO DA VINCI
PR;4107256;DOURADINA;50954;P72690;POLO UNOPAR DE DOURADINA
PR;4107504;ENGENHEIRO BELTRAO;50995;P71910;POLO DE APOIO PRESENCIAL DE ENGENHEIRO BELTRÃO
PR;4107603;FAXINAL;50921;P72389;UAB - POLO PRESENCIAL FAXINAL
PR;4107652;FAZENDA RIO GRANDE;50955;P72824;COLÉGIO ESTADUAL OLINDAMIR MERLIN CLAUDINO - EFM
PR;4107702;FENIX;50956;P73166;COLÉGIO ESTADUAL SANTO INACIO DE LOYOLA
PR;4107900;FLORESTA;50957;P73041;ESCOLA MUNICIPAL MESSIAS BARBOSA FERREIRA
PR;4108205;FORMOSA DO OESTE;50958;P72936;ESCOLA MUNICIPAL NILZA DE OLIVEIRA PIPINO
PR;4108304;FOZ DO IGUACU;50888;P70446;UNIOESTE - UNIVERSIDADE ESTADUAL DO OESTE DO PARANÁ - CAMPUS DE FOZ DO IGUAÇU
PR;4108304;FOZ DO IGUACU;50889;P71369;UNILA
PR;4108403;FRANCISCO BELTRAO;50895;P71146;UNIPAR
PR;4108601;GOIOERE;50850;P72702;POLO UAB GOIOERE
PR;4108809;GUAIRA;50877;P71412;UNIPAR
PR;4109302;GUARANIACU;51006;P72131;POLO UAB GUARANIAÇU
PR;4109401;GUARAPUAVA;51007;P70360;UNIVERSIDADE ESTADUAL DO CENTRO OESTE - UNICENTRO - CAMPUS SANTA CRUZ
PR;4109500;GUARAQUECABA;51005;P73350;ESCOLA MUNICIPAL ANTÔNIO BARBOSA PINTO
PR;4109609;GUARATUBA;50959;P72457;COLÉGIO ESTADUAL CÍVICO MILITAR 29 DE ABRIL
PR;4109708;IBAITI;51010;P72048;UNOPAR ANHANGUERA POLO IBAITI
PR;4109807;IBIPORA;50857;P71974;COLÉGIO ESTADUAL OLAVO BILAC
PR;4109906;ICARAIMA;51013;P72755;COLÉGIO DESEMBRAGADOR ANTONIO FRANCO FERREIRA DA COSTA
PR;4110078;IMBAU;51012;P73342;POLO IMBAU
PR;4110102;IMBITUVA;51019;P72798;COLÉGIO ESTADUAL CÍVICO MILITAR ALCIDES MUNHOZ
PR;4110201;INACIO MARTINS;50960;P73099;COLÉGIO ESTADUAL PARIGOT DE SOUZA
PR;4110300;INAJA;50961;P72428;ESCOLA MUNICIPAL DOUTOR NARBAL ORESTE MAY - E.F
PR;4110508;IPIRANGA;50904;P72388;POLO UAB IPIRANGA
PR;4110607;IPORA;51040;P72769;UNICESUMAR
PR;4110706;IRATI;51020;P71308;UNICENTRO-UNIV. EST. DO CENTRO OESTE
PR;4110953;ITAIPULANDIA;50905;P72357;UNIP UNIVERSIDADE PAULISTA
PR;4111258;ITAPERUCU;50906;P72656;CE CIVICO MILITAR VEREADOR LUIZ MALTACA
PR;4111506;IVAIPORA;50843;P71166;FATEC - FACULDADE DE TECNOLOGIA DO VALE DO IVA
PR;4111555;IVATE;50962;P73346;ESCOLA MUNICIPAL PROFESSOR WALTER BERGMAN
PR;4111605;IVATUBA;51014;P72508;FAP - FACULDADE ADVENTISTA  DO PARANÁ
PR;4111803;JACAREZINHO;50854;P72827;UNIVERSIDADE ESTADUAL DO NORTE DO PARANÁ - UENP
PR;4111902;JAGUAPITA;50963;P72928;ESCOLA MUNICIPAL PROFESSOR NEWTON GUIMARÃES
PR;4112009;JAGUARIAIVA;51021;P72406;IFPR CAMPUS JAGUARIAIVA
PR;4112108;JANDAIA DO SUL;50844;P72393;FUNDAÇÃO EDUCACIONAL JANDAIA DO SUL FAFIJAN
PR;4112405;JAPURA;50964;P73126;COLÉGIO ESTADUAL RUI BARBOSA
PR;4112504;JARDIM ALEGRE;50907;P72364;UNINGÁ - ENSINO A DISTÂNCIA
PR;4113205;LAPA;50965;P71133;UNIFAEL
PR;4113304;LARANJEIRAS DO SUL;50878;P72231;CENTRO UNIVERSITÁRIO CAMPO REAL
PR;4113502;LOANDA;50868;P74112;COLÉGIO ESTADUAL GUILHERME DE ALMEIDA - EFM
PR;4113700;LONDRINA;50859;P68581;UNICESUMAR
PR;4113700;LONDRINA;50858;P72878;PUC PR - CAMPUS LONDRINA
PR;4113908;MALLET;50966;P72498;ESCOLA M PROF. ONÉSIMO JURASZEK
PR;4114005;MAMBORE;50999;P72574;INTEGRADO - EAD_POLO MAMBORÊ
PR;4114104;MANDAGUACU;51015;P72488;ESCOLA MUNICIPAL BARÃO DO RIO BRANCO
PR;4114203;MANDAGUARI;51016;P72783;FAFIMAN
PR;4114302;MANDIRITUBA;50967;P72365;ESCOLA MUNICIPAL BOM JESUS
PR;4114401;MANGUEIRINHA;50908;P72726;POLO UNIFACVEST E UNIGUAIRACA
PR;4114500;MANOEL RIBAS;50968;P72341;CEEP - CENTRO ESTADUAL DE EDUCAÇÃO PROFISSIONAL MANOEL RIBAS
PR;4114609;MARECHAL CANDIDO RONDON;50879;P71202;UNIOESTE - UNIVERSIDADE ESTADUAL DO OESTE DO PARANÁ
PR;4114807;MARIALVA;50862;P72223;UNICESUMAR MARIALVA
PR;4114906;MARILANDIA DO SUL;50969;P72920;ESCOLA MUNICIPAL ANGELO MULLER FILHO - ENSINO FUNDAMENTAL
PR;4115101;MARILUZ;51041;P72467;ESCOLA MUNICIPAL MANOEL RIBAS EDUCAÇÃO INFANTIL E ENSINO FUNDAMENTAL
PR;4115200;MARINGA;50863;P70304;UNICESUMAR
PR;4115200;MARINGA;50864;P70304;UNICESUMAR
PR;4115200;MARINGA;50865;P70304;UNICESUMAR
PR;4115606;MATELANDIA;50970;P72431;POLO UNIFACVEST
PR;4115705;MATINHOS;50971;P72541;UNIVERSIDADE FEDERAL DO PARANÁ - SETOR LITORAL
PR;4115804;MEDIANEIRA;50880;P71494;CENTRO UNIVERSITÁRIO UDC
PR;4116059;MISSAL;50972;P73092;COLÉGIO ESTADUAL PE EDUARDO MICHELIS
PR;4116208;MORRETES;50909;P72799;COLÉGIO ESTADUAL ROCHA POMBO
PR;4116703;NOVA AURORA;50973;P72333;ESCOLA ESTADUAL JORGE NACLI - ENSINO FUNDAMENTAL
PR;4116901;NOVA ESPERANCA;50869;P73132;ESCOLA MUNICIPAL JULIO BENATTI
PR;4117107;NOVA LONDRINA;51032;P72359;POLO UAB NOVA LONDRINA
PR;4117222;NOVA SANTA ROSA;50974;P72535;ESCOLA MUNICIPAL GETÚLIO VARGAS
PR;4117305;ORTIGUEIRA;51022;P72103;DS CURSOS
PR;4117503;PAICANDU;50866;P72350;C. E. PRINCESA IZABEL
PR;4117602;PALMAS;50896;P72319;INSTITUTO FEDERAL DO PARANÁ
PR;4117701;PALMEIRA;51023;P72976;COLÉGIO ESTADUAL DOM ALBERTO GONÇALVES
PR;4117800;PALMITAL;50910;P73147;POLO UAB PALMITAL
PR;4117909;PALOTINA;50881;P72234;COLÉGIO ESTADUAL SANTO AGOSTINHO
PR;4118006;PARAISO DO NORTE;50975;P72651;UNIBF
PR;4118105;PARANACITY;50976;P73349;COLÉGIO ESTADUAL ANTÔNIO TORTATO
PR;4118204;PARANAGUA;50977;P74320;ISULPAR
PR;4118402;PARANAVAI;50870;P71335;CENTRO UNIVERSITÁRIO UNIFATECIE
PR;4118501;PATO BRANCO;50897;P71063;UNIMATER - CENTRO UNIVERSITÁRIO MATER DEI
PR;4118907;PEROLA;51042;P72650;COLÉGIO ESTADUAL NESTOR VICTOR
PR;4119103;PIEN;50911;P72307;COLÉGIO ESTADUAL FREDERICO GUILHERME GIESE
PR;4119152;PINHAIS;50978;P74278;COLÉGIO HUMBERTO DE ALENCAR CASTELO BRANCO
PR;4119202;PINHALAO;50979;P72257;ESCOLA ESTADUAL CASTRO ALVES
PR;4119301;PINHAO;51008;P72348;CENSUPEG
PR;4119400;PIRAI DO SUL;50912;P72610;CE JORGE QUEIROZ NETTO - CEJQN
PR;4119509;PIRAQUARA;50980;P72325;C.E. IVANETE MARTINS DE SOUZA
PR;4119608;PITANGA;51009;P71273;IFPR CAMPUS PITANGA
PR;4119657;PITANGUEIRAS;50981;P72298;ESCOLA MUNICIPAL SANTO ANTONIO
PR;4119905;PONTA GROSSA;51024;P70689;UNICESUMAR
PR;4119905;PONTA GROSSA;51025;P70689;UNICESUMAR
PR;4119954;PONTAL DO PARANA;51030;P72432;UNINTER POLO PONTAL DO PARANÁ
PR;4120002;PORECATU;50860;P72405;COLÉGIO ESTADUAL RICARDO LUNARDELLI
PR;4120606;PRUDENTOPOLIS;51026;P73109;ESCOLA MUNICIPAL CLOTILDE DOS SANTOS GOMES
PR;4120804;QUATRO BARRAS;50982;P72509;COLÉGIO ESTADUAL ARLINDA FERREIRA CREPLIVE
PR;4120903;QUEDAS DO IGUACU;50882;P72132;IFPR CAMPUS QUEDAS DO IGUAÇU
PR;4121000;QUERENCIA DO NORTE;50983;P73058;FACULDADE UNINA - POLO QUERÊNCIA DO NORTE
PR;4121208;QUITANDINHA;50913;P72337;UNINTER POLO QUITANDINHA
PR;4121406;REALEZA;50883;P73103;UFFS UNIVERSIDADE FEDERAL DA FRONTEIRA SUL
PR;4121703;RESERVA;51027;P72331;POLO UAB DE RESERVA
PR;4121802;RIBEIRAO CLARO;50914;P73051;ESCOLA MUNICIPAL PROFª JOVIRA CONTI NEIA
PR;4122107;RIO BOM;50915;P72268;SEAD POLO DE ENSINO A DISTÂNCIA
PR;4122172;RIO BRANCO DO IVAI;50984;P72738;COLÉGIO ESTADUAL RIO BRANCO - ENSINO FUNDAMENTAL E MÉDIO
PR;4122206;RIO BRANCO DO SUL;50985;P72809;CE PROF MANOEL BORGES DE MACEDO
PR;4122305;RIO NEGRO;50986;P70667;ASSOCIAÇÃO FRANCISCANA DE ENSINO SENHOR BOM JESUS
PR;4122404;ROLANDIA;50861;P72246;FACULDADE PARANAENSE - FACCAR
PR;4122503;RONCADOR;51000;P72787;UNICESUMAR
PR;4122651;ROSARIO DO IVAI;50987;P72588;ESCOLA MUNICIPAL VEREADOR JOSE RODRIGUES
PR;4123402;SANTA FE;50923;P73797;COLÉGIO MARECHAL ARTHUR DA COSTA E SILVA
PR;4123501;SANTA HELENA;50884;P72500;ESCOLA MUNICIPAL MARECHAL DEODORO DA FONSECA
PR;4123808;SANTA IZABEL DO OESTE;50988;P72722;EDUCACENTER - POLO FAG EAD
PR;4124020;SANTA TEREZA DO OESTE;50989;P72429;COLÉGIO ESTADUAL SANTA TEREZA DO OESTE
PR;4124053;SANTA TEREZINHA DE ITAIPU;50890;P72515;ESCOLA MUNICIPAL CECÍLIA MEIRELES
PR;4124103;SANTO ANTONIO DA PLATINA;50855;P71077;FANORPI
PR;4124400;SANTO ANTONIO DO SUDOESTE;50898;P72795;ESCOLA MUNCIPAL CÍVICO MILITAR PROF. JACINTA RODRIGUES DOS SANTOS
PR;4124509;SANTO INACIO;50990;P72382;ESCOLA MUNICIPAL OMAR DE OLIVEIRA
PR;4124806;SAO JOAO;50916;P73042;COLÉGIO ESTADUAL TANCREDO NEVES
PR;4125100;SAO JOAO DO TRIUNFO;50991;P72800;COLÉGIO ESTADUAL FRANCISCO NEVES FILHO
PR;4125209;SAO JORGE DOESTE;50992;P72534;ESCOLA MUNICIPAL SÃO JORGE
PR;4125506;SAO JOSE DOS PINHAIS;50993;P70835;CENTRO UNIVERSITÁRIO SENAI PARANÁ UNISENAI
PR;4125605;SAO MATEUS DO SUL;51043;P72463;COLÉGIO ESTADUAL DUQUE DE CAXIAS-ENSINO FUNDAMENTAL, MÉDIO E PROFISSIONAL
PR;4125704;SAO MIGUEL DO IGUACU;50885;P71934;FACULDADE UNIGUAÇU
PR;4125803;SAO PEDRO DO IVAI;50922;P72514;ESCOLA MUNICIPAL PROFESSORA ALFREDINA FERNANDES GOUVEIA EDUCAÇÃO INFANTIL E ENSINO FUNDAMENTAL
PR;4126256;SARANDI;50867;P71778;UNIASSELVI
PR;4126306;SENGES;51034;P72518;DREAMSCHOOL
PR;4126504;SERTANOPOLIS;50917;P73354;COLEGIO MUNICIPAL LUIZ DELIBERADOR
PR;4126603;SIQUEIRA CAMPOS;51028;P73174;POLO UAB SIQUEIRA CAMPOS
PR;4127106;TELEMACO BORBA;51035;P71134;INSTITUTO FEDERAL DO PARANÁ - CAMPUS TELÊMACO BORBA
PR;4127205;TERRA BOA;50996;P72452;COLÉGIO ESTADUAL HELENA KOLODY
PR;4127304;TERRA RICA;51033;P72415;ESCOLA MUNICIPAL ROSALINA DE MORAES
PR;4127403;TERRA ROXA;51003;P72128;ESCOLA MUNICIPAL PRESIDENTE KENNEDY - EDUCAÇÃO INFANTIL, ENSINO FUNDAMENTAL E EJA
PR;4127502;TIBAGI;51029;P73169;POLO UAB TIBAGI
PR;4127601;TIJUCAS DO SUL;50918;P72442;ESCOLA MUNICIPAL DO CAMPO PROFESSORA LEOVANIL CAMARGO
PR;4127700;TOLEDO;50886;P71148;UNIVERSIDADE ESTADUAL DO OESTE DO PARANÁ
PR;4127965;TURVO;50919;P73093;ESCOLA MUNICIPAL FRIDA RICKLI NAIVERTH
PR;4128005;UBIRATA;50887;P72806;´POLO UAB  UBIRATÃ
PR;4128104;UMUARAMA;50871;P71198;UNIVERSIDADE PARANAENSE - UNIPAR SEDE
PR;4128203;UNIAO DA VITORIA;51044;P71337;UNIVERSIDADE ESTADUAL DO PARANÁ - CAMPUS DE UNIÃO DA VITÓRIA
PR;4128401;URAI;51036;P72397;ESCOLA MUNICIPAL DR. JOÃO RIBEIRO JUNIOR
PR;4128500;WENCESLAU BRAZ;51011;P72280;UNOPAR
RJ;3300100;ANGRA DOS REIS;51344;P70758;COLÉGIO ESTADUAL DR. ARTUR VARGAS
RJ;3300209;ARARUAMA;51345;P70524;ESCOLA BILÍNGUE MUNICIPAL SUELI AMARAL
RJ;3300233;ARMACAO DOS BUZIOS;51347;P72767;ESCOLA MUNICIPAL PROFESSORA DARCY RIBEIRO
RJ;3300258;ARRAIAL DO CABO;51348;P72921;COLÉGIO  MUNICIPAL ADOLFO BERENGER
RJ;3300308;BARRA DO PIRAI;51349;P72267;COLÉGIO ESTADUAL JOAQUIM DE MACEDO
RJ;3300407;BARRA MANSA;51450;P72909;CENTRO EDUCACIONAL INTEGRADO VIEIRA DA SILVA
RJ;3300456;BELFORD ROXO;51408;P70648;COLÉGIO ESTADUAL PRESIDENTE KENNEDY
RJ;3300506;BOM JARDIM;51352;P72314;C. E. RAMIRO BRAGA
RJ;3300605;BOM JESUS DO ITABAPOANA;51419;P72026;COLÉGIO ESTADUAL PADRE DE MELLO
RJ;3300704;CABO FRIO;51354;P70574;UNIVERSIDADE ESTACIO DE SÁ
RJ;3300803;CACHOEIRAS DE MACACU;51357;P71423;CIEP ETEC 14 MÁRIO CÉSAR GOMES DA SILVA
RJ;3300951;COMENDADOR LEVY GASPARIAN;51364;P72470;CIEP MUNICIPALIZADO PADRE JOAQUIM CHAVES DE FIGUEIREDO
RJ;3301009;CAMPOS DOS GOYTACAZES;51358;P70280;UNIVERSIDADE ESTÁCIO DE SÁ - CAMPOS DOS GOYTACAZES
RJ;3301108;CANTAGALO;51426;P72786;POLO CEDERJ - UAB - CANTAGALO
RJ;3301207;CARMO;51361;P72834;ESCOLA MUNICIPAL ANTONIO RUSSIER
RJ;3301306;CASIMIRO DE ABREU;51437;P71973;CIEP BRIZOLÃO 459 - MUNICIPALIZADO JOSÉ BICUDO JARDIM
RJ;3301405;CONCEICAO DE MACABU;51400;P72774;ESCOLA MUNICIPAL FREI VALÉRIO
RJ;3301504;CORDEIRO;51401;P71763;COLÉGIO ESTADUAL ANTÔNIO PECLY
RJ;3301702;DUQUE DE CAXIAS;51362;P70447;ESTÁCIO DE SÁ - CAMPUS I
RJ;3301702;DUQUE DE CAXIAS;51363;P71183;UNIVERSIDADE ESTÁCIO DE SÁ CAMPUS II
RJ;3301801;ENGENHEIRO PAULO DE FRONTIN;51402;P72916;COLÉGIO ESTADUAL JOÃO KOPKE
RJ;3301850;GUAPIMIRIM;51421;P72923;ESCOLA MUNICIPAL PROFESSORA ACÁCIA LEITÃO PORTELLA
RJ;3301876;IGUABA GRANDE;51355;P72784;COLÉGIO ESTADUAL DOUTOR FRANCISCO DE PAULA PARANHOS
RJ;3301900;ITABORAI;51415;P72125;CIEP BRIZOLÃO 130 DR ELIAS DE MIRANDA SARAIVA
RJ;3302007;ITAGUAI;51417;P70371;CIEP 048 DJALMA MARANHÃO
RJ;3302056;ITALVA;51365;P72306;COLÉGIO ESTADUAL JOÃO  GUIMARÃES
RJ;3302106;ITAOCARA;51439;P72177;CIEP 275 LENINE CORTES FALANTE
RJ;3302205;ITAPERUNA;51420;P71924;UNIG - UNIVERSIDADE IGUAÇU - ITAPERUNA - CAMPUS V
RJ;3302254;ITATIAIA;51366;P73330;COLÉGIO MUNICIPAL REINALDO MAIA SOUTO
RJ;3302270;JAPERI;51433;P72227;C E JOÃO SOUTO SANTOS
RJ;3302403;MACAE;51442;P70521;ESTÁCIO DE SÁ - CAMPUS MACAÉ
RJ;3302502;MAGE;51422;P71234;ESCOLA MUNICIPAL GERALDA IZAURA FERREIRA TELLES
RJ;3302601;MANGARATIBA;51367;P72369;ESCOLA MUNICIPAL CORONEL MOREIRA DA SILVA
RJ;3302700;MARICA;51423;P70737;C.E.P.T PROFª ZILCA LOPES DA FONTOURA
RJ;3302809;MENDES;51368;P72010;CIEP 288 - PROFESSOR RUY GONÇALVES RAMOS
RJ;3302858;MESQUITA;51409;P71470;ESCOLA MUNICIPAL ROTARIANO ARTHUR SILVA
RJ;3302908;MIGUEL PEREIRA;51424;P72716;ESCOLA MUNICIPAL CORONEL EDMUNDO MACEDO SOARES E SILVA
RJ;3303005;MIRACEMA;51440;P72966;GINÁSIO DE MIRACEMA ESCOLA DE PROFESSORES
RJ;3303104;NATIVIDADE;51425;P72772;COLÉGIO ESTADUAL FRANCISCO PORTELLA
RJ;3303203;NILOPOLIS;51410;P70791;UNIABEU-CAMPUS NILÓPOLIS
RJ;3303302;NITEROI;51407;P70256;UNIVERSIDADE ESTÁCIO DE SÁ - NITERÓI I
RJ;3303302;NITEROI;51404;P73744;CENTRO UNIVERSITÁRIO ANHANGUERA NITERÓI
RJ;3303302;NITEROI;51405;P73744;CENTRO UNIVERSITÁRIO ANHANGUERA NITERÓI
RJ;3303302;NITEROI;51406;P73748;COLÉGIO ESTADUAL GUILHERME BRIGGS
RJ;3303401;NOVA FRIBURGO;51403;P71131;COLÉGIO ESTADUAL CANADÁ
RJ;3303500;NOVA IGUACU;51411;P70303;UNIG - UNIVERSIDADE IGUAÇU
RJ;3303500;NOVA IGUACU;51412;P70303;UNIG - UNIVERSIDADE IGUAÇU
RJ;3303500;NOVA IGUACU;51413;P70303;UNIG - UNIVERSIDADE IGUAÇU
RJ;3303609;PARACAMBI;51434;P71907;INSTITUTO FEDERAL DO RIO DE JANEIRO - PARACAMBI
RJ;3303708;PARAIBA DO SUL;51448;P72336;COLÉGIO ESTADUAL MONSENHOR FRANCISCO
RJ;3303807;PARATY;51427;P72039;COLÉGIO ESTADUAL ALMIRANTE ÁLVARO ALBERTO
RJ;3303856;PATY DO ALFERES;51432;P72062;E.M JOÃO ABREU
RJ;3303906;PETROPOLIS;51429;P70093;UNIVERSIDADE ESTÁCIO DE SÁ - PETRÓPOLIS
RJ;3303955;PINHEIRAL;51430;P72746;CIEP 291 DOM MARTINHO SCHLUDE
RJ;3304003;PIRAI;51353;P72455;COLÉGIO ESTADUAL AFFONSINA MAZZILLO TEIXEIRA CAMPOS
RJ;3304102;PORCIUNCULA;51428;P72260;ESCOLA MUNICIPAL ORLINDA VEIGA
RJ;3304110;PORTO REAL;51431;P72561;COLÉGIO ESTADUAL REPÚBLICA ITALIANA
RJ;3304144;QUEIMADOS;51435;P71174;UNIVERSIDADE ESTÁCIO DE SÁ
RJ;3304151;QUISSAMA;51369;P72036;ESCOLA MUNICIPAL PROFESSORA TÂNIA REGINA PAULA
RJ;3304201;RESENDE;51436;P71056;ESTÁCIO
RJ;3304300;RIO BONITO;51416;P72265;COLÉGIO ESTADUAL PROFESSOR DYRCEU RODRIGUES DA COSTA
RJ;3304409;RIO CLARO;51370;P72977;COLÉGIO ESTADUAL FAGUNDES VARELA
RJ;3304524;RIO DAS OSTRAS;51438;P70613;CIEP BRIZOLÃO 257 - JOAQUIM DO REGO BARROS
RJ;3304557;RIO DE JANEIRO;51397;P69026;UNIVERSIDADE ESTÁCIO DE SÁ - CAMPUS RECREIO
RJ;3304557;RIO DE JANEIRO;51390;P69057;UNIVERSIDADE ESTÁCIO DE SÁ - CAMPUS NORTE SHOPPING
