SG_UF_PROVA;CO_MUNICIPIO_PROVA;NO_MUNICIPIO_PROVA;CO_COORDENACAO;CO_LOCAL;NO_LOCAL_PROVA
MG;3144102;MUZAMBINHO;51804;P73574;INSTITUTO FEDERAL DE CIÊNCIA E TECNOLOGIA DO SUL DE MINAS GERAIS CAMPUS MUZAMBINHO
MG;3144300;NANUQUE;51774;P72170;CENTRO UNIVERSITÁRIO DE CARATINGA CAMPUS UNEC  DE NANUQUE
MG;3144359;NAQUE;51664;P73865;ESCOLA MUNICIPAL PEDRO FERNANDES MAFRA
MG;3144607;NEPOMUCENO;51725;P73369;ESCOLA ESTADUAL DR ERNANE VILELA LIMA
MG;3144706;NOVA ERA;51665;P73567;ESCOLA MUNICIPAL DESEMBARGADOR DRUMOND
MG;3144805;NOVA LIMA;51630;P71518;ESCOLA ESTADUAL JOÃO FELIPE DA ROCHA
MG;3145059;NOVA PORTEIRINHA;51666;P74037;E. M. PROFESSOR DARCY RIBEIRO
MG;3145208;NOVA SERRANA;51574;P70414;FANS FUNDAÇÃO EDUCACIONAL FAUSTO PINTO DA FONSECA
MG;3145307;NOVO CRUZEIRO;51707;P74377;ESCOLA ESTADUAL INÁCIO MURTA
MG;3145356;NOVO ORIENTE DE MINAS;51667;P72728;ESCOLA ESTADUAL PAULO PINHEIRO CHAGAS
MG;3145604;OLIVEIRA;51609;P70711;EE DR JOSÉ MARIA LOBATO
MG;3145901;OURO BRANCO;51721;P72437;ESCOLA MUNICIPAL LIVREMENTE
MG;3146008;OURO FINO;51815;P73139;ESCOLA ESTADUAL FRANCISCO RIBEIRO DA FONSECA
MG;3146107;OURO PRETO;51589;P70864;UFOP - BLOCO DE SALAS DE AULAS
MG;3146305;PADRE PARAISO;51708;P73489;ESCOLA ESTADUAL PROFESSOR JOSÉ MONTEIRO FONSECA
MG;3147006;PARACATU;51729;P70996;ESCOLA ESTADUAL ANTÔNIO CARLOS
MG;3147105;PARA DE MINAS;51590;P70925;FACULDADE DE PARÁ DE MINAS FAPAM
MG;3147204;PARAGUACU;51668;P73581;ESCOLA MUNICIPAL LUIZ DE MELO VIANA SOBRINHO
MG;3147303;PARAISOPOLIS;51555;P73723;ESCOLA ESTADUALEULÁLIA GOMES DE OLIVEIRA
MG;3147402;PARAOPEBA;51593;P72259;E. E. CONSELHEIRO AFONSO PENA
MG;3147600;PASSA QUATRO;51556;P73456;ESCOLA ESTADUAL CORONEL ARTUR TIBÚRCIO
MG;3147907;PASSOS;51731;P70836;UNIVERSIDADE DO ESTADO DE MINAS GERAIS- BLOCO V CIRE
MG;3148004;PATOS DE MINAS;51734;P70359;CENTRO UNIVERSITÁRIO PATOS DE MINAS - BLOCO C/M/N
MG;3148004;PATOS DE MINAS;51735;P70359;CENTRO UNIVERSITÁRIO PATOS DE MINAS - BLOCO C/M/N
MG;3148004;PATOS DE MINAS;51736;P70359;CENTRO UNIVERSITÁRIO PATOS DE MINAS - BLOCO C/M/N
MG;3148103;PATROCINIO;51738;P70901;ESCOLA ESTADUAL PROFESSORA ORMY ARAÚJO AMARAL
MG;3149309;PEDRO LEOPOLDO;51697;P71176;ESCOLA MUNICIPAL DONA NHAZINHA CARVALHO
MG;3149804;PERDIZES;51669;P73521;ESCOLA ESTADUAL PADRE JOÃO BALKER
MG;3149903;PERDOES;51564;P73254;ESCOLA MUNICIPAL OTAVIANO ALVARENGA
MG;3149952;PERIQUITO;51670;P73544;EE DEPUTADO HILO ANDRADE
MG;3150802;PIRANGA;51671;P73047;ESCOLA ESTADUAL CORONEL JOSÉ ILDEFONSO
MG;3151107;PIRAPETINGA;51778;P73586;ESCOLA ESTADUAL CAPITÃO OVÍDIO LIMA
MG;3151206;PIRAPORA;51739;P70595;ESCOLA ESTADUAL PROFESSORA HELOÍSA PASSOS
MG;3151404;PITANGUI;51591;P72003;E. E. DOUTOR JACINTO ÁLVARES
MG;3151503;PIUMHI;51581;P72685;E.E. PROF. FRANCISCO DE PAULA REBELO HORTA
MG;3151800;POCOS DE CALDAS;51807;P70601;PUC MINAS - POÇOS DE CALDAS
MG;3152006;POMPEU;51604;P73130;ESCOLA ESTADUAL MINISTRO FRANCISCO CAMPOS
MG;3152105;PONTE NOVA;51592;P70552;ESCOLA ESTADUAL CARLOS TRIVELLATO
MG;3152204;PORTEIRINHA;51785;P73059;ESCOLA ESTADUAL ALCIDES MENDES DA SILVA
MG;3152501;POUSO ALEGRE;51742;P70431;FACULDADE DE DIREITO DO SUL DE MINAS
MG;3152501;POUSO ALEGRE;51743;P70431;FACULDADE DE DIREITO DO SUL DE MINAS
MG;3152501;POUSO ALEGRE;51741;P74326;CONSERVATÓRIO ESTADUAL DE MÚSICA JKO
MG;3152808;PRATA;51777;P73786;ESCOLA ESTADUAL DO PRATA
MG;3154002;RAUL SOARES;51568;P73239;ESCOLA ESTADUAL REGINA PACIS
MG;3154150;REDUTO;51672;P74029;ESCOLA ESTADUAL CARLOS NOGUEIRA DA GAMA
MG;3154309;RESPLENDOR;51557;P73341;ESCOLA MUNICIPAL CONSELHEIRO LAFAIETE
MG;3154606;RIBEIRAO DAS NEVES;51692;P70889;FACULDADE ANHANGUERA RIBEIRÃO DAS NEVES
MG;3154903;RIO CASCA;51673;P73534;ESCOLA ESTADUAL IMACULADA CONCEIÇÃO
MG;3155504;RIO PARANAIBA;51674;P71620;UNIVERSIDADE FEDERAL DE VIÇOSA
MG;3155702;RIO PIRACICABA;51675;P73714;ESCOLA ESTADUAL PROFESSOR ANTÔNIO FERNANDES PINTO
MG;3155801;RIO POMBA;51691;P73712;ESCOLA ESTADUAL PROFESSOR JOSÉ BORGES DE MORAIS
MG;3156452;ROSARIO DA LIMEIRA;51676;P73532;E E CÔNEGO AMÉRICO DUARTE
MG;3156700;SABARA;51694;P70519;ESCOLA ESTADUAL DONA BILU FIGUEIREDO
MG;3156908;SACRAMENTO;51563;P72118;ESCOLA ESTADUAL ESCRITORA CAROLINA MARIA DE JESUS
MG;3157005;SALINAS;51792;P73137;ESCOLA ESTADUAL PROFESSOR LEVINDO LAMBERT
MG;3157203;SANTA BARBARA;51677;P73050;COLÉGIO MUNICIPAL AFONSO PENA
MG;3157708;SANTA JULIANA;51558;P73249;ESCOLA ESTADUAL SANTA JULIANA 1º E 2º GRAUS
MG;3157807;SANTA LUZIA;51631;P70410;ESCOLA ESTADUAL GERALDO TEIXEIRA DA COSTA
MG;3157906;SANTA MARGARIDA;51678;P73617;ESCOLA ESTADUAL DALILA CERQUEIRA PESSOA
MG;3158953;SANTANA DO PARAISO;51680;P73509;ESCOLA ESTADUAL ALBERTINO FERREIRA DRUMOND
MG;3159357;SANTA RITA DE MINAS;51679;P73557;ESCOLA ESTADUAL JOSEFINA VIEIRA
MG;3159605;SANTA RITA DO SAPUCAI;51744;P71004;ESCOLA ESTADUAL DR LUIZ PINTO DE ALMEIDA
MG;3160405;SANTO ANTONIO DO MONTE;51559;P73416;ESCOLA ESTADUAL PADRE PAULO
MG;3160702;SANTOS DUMONT;51756;P72278;ESCOLA ESTADUAL ENGENHEIRO HENRIQUE DUMONT
MG;3161007;SAO DOMINGOS DO PRATA;51681;P74065;ESCOLA ESTADUAL CORONEL FRANCISCO ROLLA
MG;3161106;SAO FRANCISCO;51793;P72380;UNIMONTES/CAMPUS SÃO FRANCISCO
MG;3162005;SAO GONCALO DO SAPUCAI;51817;P73758;ESCOLA ESTADUAL MINISTRO LÚCIO DE MENDONÇA
MG;3162104;SAO GOTARDO;51775;P73175;ESCOLA ESTADUAL JOSÉ CAETANO RIBEIRO
MG;3162500;SAO JOAO DEL REI;51745;P70429;UFSJ / CAMPUS SANTO ANTÔNIO
MG;3162708;SAO JOAO DO PARAISO;51782;P72948;ESCOLA ESTADUAL PROFESSORA DORA BARBOSA
MG;3162807;SAO JOAO EVANGELISTA;51769;P72212;IFMG CAMPUS SÃO JOÃO EVANGELISTA PRÉDIO IV CIÊNCIAS AGRÁRIAS
MG;3162906;SAO JOAO NEPOMUCENO;51682;P71885;ESCOLA MUNICIPAL DONA PRUDENCIANA FAUSTINA DE SÃO JOSÉ
MG;3162922;SAO JOAQUIM DE BICAS;51614;P73309;E.E. PROFESSORA GERALDA EUGÊNIA DA SILVA
MG;3163706;SAO LOURENCO;51809;P70747;ESCOLA MUNICIPAL CORONEL MANOEL DIAS FERRAZ
MG;3164308;SAO ROQUE DE MINAS;51560;P74068;ESCOLA ESTADUAL GENERAL CARNEIRO
MG;3164704;SAO SEBASTIAO DO PARAISO;51732;P70960;ESCOLA ESTADUAL CLÓVIS SALGADO
MG;3165503;SARDOA;51683;P73649;ESCOLA MUNICIPAL PROFESSORA MARIA NASCENTE SILVA
MG;3165537;SARZEDO;51615;P73427;ESCOLA ESTADUAL PROFESSOR CARNEIRO SANTIAGO
MG;3165552;SETUBINHA;51686;P73291;ESCOLA ESTADUAL NAGIB MAHMUD NEDIR
MG;3166808;SERRA DO SALITRE;51684;P73620;ESCOLA MUNICIPAL SENADOR LÚCIO BITTENCOUT
MG;3167103;SERRO;51685;P73345;ESCOLA ESTADUAL LUIZA DE MARILAC
MG;3167202;SETE LAGOAS;51594;P70522;UNIVERSIDADE FEDERAL DE SÃO JOÃO DEL REI - CAMPUS SETE LAGOAS (CSL) - UFSJ - ITAPOÃ
MG;3167202;SETE LAGOAS;51595;P71023;UNIVERSIDADE FEDERAL DE SÃO JOÃO DEL REI - CAMPUS SETE LAGOAS (CSL) - UFSJ - BR PRUDENTE
MG;3168002;TAIOBEIRAS;51783;P73054;ESCOLA ESTADUAL OSWALDO LUCAS MENDES
MG;3168606;TEOFILO OTONI;51746;P70418;UNIDOCTUM CAMPUS TEÓFILO OTONI
MG;3168705;TIMOTEO;51602;P71893;ESCOLA ESTADUAL PROFESSORA ANA LETRO STAACKS
MG;3169109;TOLEDO;51687;P74035;ESCOLA ESTADUAL RAIMUNDO CORREA
MG;3169307;TRES CORACOES;51810;P71196;CENTRO UNIVERSITÁRIO VALE DO RIO VERDE - UNINCOR
MG;3169356;TRES MARIAS;51776;P72271;ESCOLA ESTADUAL JOÃO GUIMARÃES ROSA
MG;3169406;TRES PONTAS;51811;P73395;FATEPS FACULDADE DE TRÊS PONTAS
MG;3169703;TURMALINA;51710;P72066;ESCOLA MUNICIPAL SÃO JOÃO BATISTA
MG;3169901;UBA;51747;P70851;UNIFAGOC- CENTR0 UNIVERSITÁRIO GOVERNADOR OZANAM COELHO
MG;3170107;UBERABA;51757;P68979;UNIVERSIDADE DE UBERABA - UNIUBE
MG;3170206;UBERLANDIA;51761;P71256;UNIPAC - BLOCOS A, B E C
MG;3170206;UBERLANDIA;51759;P74368;UNIVERSIDADE FEDERAL DE UBERLÂNDIA  UFU -  CAMPUS UMUARAMA - BLOCO  8C
MG;3170206;UBERLANDIA;51760;P74368;UNIVERSIDADE FEDERAL DE UBERLÂNDIA  UFU -  CAMPUS UMUARAMA - BLOCO  8C
MG;3170404;UNAI;51749;P74338;EE VIRGÍLIO DE MELO FRANCO
MG;3170578;VARGEM ALEGRE;51561;P73734;FACULDADE ALFA UNIPAC
MG;3170701;VARGINHA;51812;P70520;FACULDADE DE DIREITO DE VARGINHA FADIVA
MG;3170800;VARZEA DA PALMA;51740;P73499;ESCOLA ESTADUAL JOSEPH HEIN
MG;3171006;VAZANTE;51711;P72291;ESCOLA MUNICIPAL ANTERO CANDINHO
MG;3171204;VESPASIANO;51698;P70323;ESCOLA ESTADUAL MACHADO DE ASSIS
MG;3171303;VICOSA;51750;P68586;UNIVERSIDADE FEDERAL DE VIÇOSA - PAVILHÃO DE AULAS I - PVA
MG;3171501;MATHIAS LOBATO;51660;P73876;ESCOLA ESTADUAL PAULO LUIZ
MG;3171600;VIRGEM DA LAPA;51562;P73628;E. E. NOSSA SENHORA DA LAPA
MG;3171808;VIRGINOPOLIS;51688;P73433;ESCOLA ESTADUAL NOSSA SENHORA DO PATROCÍNIO
MG;3172004;VISCONDE DO RIO BRANCO;51748;P71965;UNIPAC - VISCONDE DO RIO BRANCO
MS;5000609;AMAMBAI;50578;P73070;ESCOLA ESTADUAL CORONEL FELIPE DE BRUM
MS;5000906;ANTONIO JOAO;50589;P73435;ESCOLA MUNICIPAL MAIKA SANABRIA PINHEIRO
MS;5001003;APARECIDA DO TABOADO;50590;P73211;ESCOLA ESTADUAL GEORGINA DE OLIVEIRA ROCHA
MS;5001102;AQUIDAUANA;50579;P71276;ESCOLA ESTADUAL CÂNDIDO MARIANO
MS;5001243;ARAL MOREIRA;50591;P72490;ESCOLA ESTADUAL DR FERNANDO CORREA DA COSTA
MS;5001904;BATAGUASSU;50580;P72430;CEJA - CENTRO EDUCACIONAL JUVENTUDE DO AMANHÃ
MS;5002100;BELA VISTA;50581;P71301;ESCOLA ESTADUAL ESTER SILVA
MS;5002209;BONITO;50592;P72464;ESCOLA ESTADUAL BONIFÁCIO CAMARGO GOMES
MS;5002407;CAARAPO;50609;P73365;ESCOLA MUNICIPAL RUI BARBOSA
MS;5002605;CAMAPUA;50593;P71244;ESCOLA ESTADUAL CAMILO BONFIM
MS;5002704;CAMPO GRANDE;50594;P68781;UNIVERSIDADE CATÓLICA DOM BOSCO (UCDB)
MS;5002704;CAMPO GRANDE;50595;P68781;UNIVERSIDADE CATÓLICA DOM BOSCO (UCDB)
MS;5002704;CAMPO GRANDE;50596;P68781;UNIVERSIDADE CATÓLICA DOM BOSCO (UCDB)
MS;5002803;CARACOL;50597;P73178;E.E.DR RUBENS DE CASTRO PINTO
MS;5002902;CASSILANDIA;50621;P72640;ESCOLA ESTADUAL HERMELINA BARBOSA LEAL
MS;5002951;CHAPADAO DO SUL;50582;P72578;FACHASUL FACULDADE DE CHAPADÃO DO SUL
MS;5003108;CORGUINHO;50584;P72409;ESCOLA ESTADUAL JOSÉ ALVES QUITO
MS;5003157;CORONEL SAPUCAIA;50586;P72999;ESCOLA ESTADUAL CORONEL SAPUCAIA
MS;5003207;CORUMBA;50585;P73577;INSTITUTO FEDERAL MATO GROSSO DO SUL CAMPUS CORUMBÁ
MS;5003256;COSTA RICA;50583;P73045;FACULDADE DE EDUCAÇÃO DE COSTA RICA
MS;5003306;COXIM;50587;P73323;CEPEFM SANTA TERESA
MS;5003454;DEODAPOLIS;50598;P73425;ESCOLA ESTADUAL SCILA MÉDICI
MS;5003702;DOURADOS;50610;P70618;UNIGRAN  EDUCACIONAL
MS;5003751;ELDORADO;50599;P73097;CENTRO EDUCACIONAL PROFISSIONAL TÉC-INFO
MS;5003801;FATIMA DO SUL;50600;P73086;EE SENADOR FILINTO MULLER
MS;5004007;GLORIA DE DOURADOS;50601;P72858;ESCOLA ESTADUAL PROFESSORA EUFROSINA PINTO
MS;5004304;IGUATEMI;50612;P72998;CENTRO EDUCACIONAL PROFESSOR SALVADOR NOGUEIRA -POLO
MS;5004403;INOCENCIA;50602;P72705;ESCOLA MUNICIPAL VISCONDE DE TAUNAY
MS;5004502;ITAPORA;50603;P72451;ESCOLA ESTADUAL RODRIGUES ALVES
MS;5004601;ITAQUIRAI;50604;P71248;ESCOLA ESTADUAL PROFESSOR JOSÉ JUAREZ RIBEIRO DE OLIVEIRA
MS;5004700;IVINHEMA;50619;P73197;E.E. SENADOR FILINTO MULLER
MS;5005004;JARDIM;50613;P72845;ESCOLA ESTADUAL CEL. PEDRO JOSÉ RUFINO
MS;5005400;MARACAJU;50615;P71695;E. E. CAMBARAI
MS;5005608;MIRANDA;50616;P71872;ESCOLA ESTADUAL CARMELITA CANALE REBUÁ
MS;5005681;MUNDO NOVO;50617;P72994;ESCOLA MUNICIPAL CARLOS CHAGAS
MS;5005707;NAVIRAI;50618;P71713;EE JURACY ALVES CARDOSO
MS;5005806;NIOAQUE;50614;P72877;EE ODETE IGNÊZ RESSTEL VILLAS BÔAS
MS;5006002;NOVA ALVORADA DO SUL;50605;P71180;ESCOLA ESTADUAL DELFINA NOGUEIRA DE SOUZA
MS;5006200;NOVA ANDRADINA;50620;P71006;UEMS - UNIDADE DE NOVA ANDRADINA
MS;5006309;PARANAIBA;50622;P70640;ESCOLA ESTADUAL MANOEL GARCIA LEAL
MS;5006606;PONTA PORA;50623;P73418;ESCOLA MUNICIPAL MANOEL MARTINS
MS;5007109;RIBAS DO RIO PARDO;50606;P71491;ESCOLA ESTADUAL DR. JOÃO PONCE DE ARRUDA
MS;5007208;RIO BRILHANTE;50611;P73036;ESCOLA ESTADUAL ETALÍVIO PEREIRA MARTINS
MS;5007406;RIO VERDE DE MATO GROSSO;50588;P71448;E E THOMAZ BARBOSA RANGEL
MS;5007695;SAO GABRIEL DO OESTE;50624;P73190;POLO UAB DE SÃO GABRIEL / ESCOLA AGRICOLA
MS;5007703;SETE QUEDAS;50607;P72713;EE 13 DE MAIO
MS;5007901;SIDROLANDIA;50608;P73124;ESCOLA ESTADUAL PROFESSORA CATARINA DE ABREU
MS;5008008;TERENOS;50625;P73063;E. E. ANTÔNIO VALADARES
MS;5008305;TRES LAGOAS;50626;P72937;AEMS - FACULDADES  INTEGRADAS DE TRÊS LAGOAS
MT;5100201;AGUA BOA;50168;P72945;EE MILITAR TIRADENTES 3º SGT JUSTINO PINHEIRO DOS SANTOS
MT;5100250;ALTA FLORESTA;50169;P70407;UNEMAT - UNIVERSIDADE DO ESTADO DE MATO GROSSO
MT;5100300;ALTO ARAGUAIA;50167;P72761;UNEMAT - CAMPUS UNIVERSITÁRIO DE ALTO ARAGUAIA
MT;5100409;ALTO GARCAS;50176;P72852;ESCOLA ESTADUAL DR YTRIO CORREA
MT;5100607;ALTO TAQUARI;50177;P72447;ESCOLA ESTADUAL CARLOS IRIGARAY FILHO
MT;5101258;ARAPUTANGA;50178;P72912;ESCOLA ESTADUAL NOSSA SENHORA DE FÁTIMA
MT;5101407;ARIPUANA;50170;P73135;ESCOLA ESTADUAL CÍVICO-MILITAR SÃO FRANCISCO DE ASSIS
MT;5101704;BARRA DO BUGRES;50172;P70284;ESCOLA ESTADUAL ALFREDO JOSE DA SILVA
MT;5101803;BARRA DO GARCAS;50171;P70556;CENTRO UNIVERSITÁRIO VALE DO ARAGUAIA
MT;5101902;BRASNORTE;50173;P73039;ESCOLA ESTADUAL EWALDO MEYER RODERJAN
MT;5102504;CACERES;50175;P70366;UNEMAT - UNIVERSIDADE DO ESTADO DE MATO GROSSO - CAMPUS JANE VANINI
MT;5102637;CAMPO NOVO DO PARECIS;50199;P72558;ESCOLA ESTADUAL MADRE TARCILA
MT;5102678;CAMPO VERDE;50202;P72421;ESCOLA TÉCNICA ESTADUAL DE EDUCAÇÃO PROFISSIONAL E TECNOLÓGICA DE CAMPO VERDE - SECITEC
MT;5102702;CANARANA;50174;P72692;EE 31 DE MARÇO
MT;5103007;CHAPADA DOS GUIMARAES;50179;P73441;E E PROF ANA TERESA ALBERNAZ
MT;5103205;COLIDER;50198;P70566;ESCOLA ESTADUAL DESEMBARGADOR MILTON ARMANDO POMPEU DE BARROS
MT;5103254;COLNIZA;50200;P72123;EE BERNARDINO GOMES DA LUZ
MT;5103304;COMODORO;50180;P72302;POLO DE APOIO PRESENCIAL UAB UNIVERSIDADE ABERTA DO BRASIL - UNEMAT
MT;5103353;CONFRESA;50201;P72706;ESCOLA ESTADUAL TEOTÔNIO CARLOS DA CUNHA NETO
MT;5103403;CUIABA;50181;P70193;FACULDADE INVEST - FACULDADE INVEST DE CIÊNCIAS E TECNOLOGIA
MT;5103403;CUIABA;50183;P72252;FACULDADE UNISSELVI
MT;5103403;CUIABA;50184;P72460;UNIASSELVI - POLO CPA
MT;5103403;CUIABA;50182;P73177;FEICS - FACULDADE EVANGÉLICA CANTARES DE SALOMÃO
MT;5103502;DIAMANTINO;50203;P70884;ESCOLA ESTADUAL JOÃO BATISTA DE ALMEIDA
MT;5103858;GAUCHA DO NORTE;50185;P73144;ESCOLA ESTADUAL GERVÁSIO DOS SANTOS COSTA
MT;5104104;GUARANTA DO NORTE;50204;P73035;ESCOLA ESTADUAL PROFESSOR ELCIO PRATES
MT;5104203;GUIRATINGA;50186;P72952;ETI ESCOLA MARIA DE LOURDES RIBEIRO  FRAGELLI
MT;5104542;ITANHANGA;50187;P72942;ESCOLA ESTADUAL BROMILDO LAWISCH
MT;5104807;JACIARA;50205;P71614;IFMT - CENTRO DE REFERÊNCIA DE JACIARA
MT;5105101;JUARA;50208;P71997;ESCOLA ESTADUAL DE DESENVOLVIMENTO INTEGRAL JOSE DIAS
MT;5105150;JUINA;50206;P71378;CENTRO DE EDUCAÇÃO MUNICIPAL PROFESSOR ORLANDO PEREIRA (ANTIGO CEJA ALTERNATIVO)
MT;5105176;JURUENA;50188;P72838;ESCOLA MUNICIPAL 07 DE MAIO
MT;5105259;LUCAS DO RIO VERDE;50209;P70501;ESCOLA ESTADUAL MILITAR TIRADENTES SD PM ADRIANA MORAES RAMOS
MT;5105580;MARCELANDIA;50210;P72695;ESCOLA ESTADUAL PAULO FREIRE
MT;5105606;MATUPA;50189;P72572;ESCOLA ESTADUAL ANTÔNIO OMETTO
MT;5105622;MIRASSOL DOESTE;50211;P71852;E.E 12 DE OUTUBRO
MT;5106216;NOVA CANAA DO NORTE;50190;P73037;EE NOVA CANAÃ
MT;5106224;NOVA MUTUM;50212;P70470;UNEMAT - UNIVERSIDADE DO ESTADO DE MATO GROSSO
MT;5106232;NOVA OLIMPIA;50229;P72974;ESCOLA ESTADUAL WILSON DE ALMEIDA
MT;5106240;NOVA UBIRATA;50213;P73420;ESCOLA ESTADUAL 19 DE DEZEMBRO
MT;5106257;NOVA XAVANTINA;50214;P72522;ESCOLA ESTADUAL MILITAR TIRADENTES CB PM DANNER MAIA BARBOSA
MT;5106307;PARANATINGA;50215;P72197;ESCOLA ESTADUAL APOLÔNIO BOURET DE MELO
MT;5106422;PEIXOTO DE AZEVEDO;50218;P73064;ESCOLA ESTADUAL 19 DE JULHO
MT;5106505;POCONE;50192;P72675;ESCOLA ESTADUAL ANTÔNIO JOÃO RIBEIRO
MT;5106752;PONTES E LACERDA;50216;P73385;INSTITUTO FEDERAL - MATO GROSSO - CAMPUS PONTES E LACERDA
MT;5106778;PORTO ALEGRE DO NORTE;50193;P73393;ESCOLA ESTADUAL ALEXANDRE QUIRINO DE SOUZA
MT;5107040;PRIMAVERA DO LESTE;50217;P70483;INSTITUTO FEDERAL DE EDUCAÇÃO, CIÊNCIA E TECNOLOGIA DO MATO GROSSO CAMPUS PRIMAVERA DO LESTE
MT;5107065;QUERENCIA;50219;P72339;ESCOLA ESTADUAL QUERÊNCIA
MT;5107107;SAO JOSE DOS QUATRO MARCOS;50195;P73173;E. E. DEP. BERTOLDO FREIRE
MT;5107180;RIBEIRAO CASCALHEIRA;50220;P73067;ESCOLA ESTADUAL CORONEL ONDINO RODRIGUES LIMA
MT;5107206;RIO BRANCO;50194;P72913;E.E. DEPUTADO FRANCISCO EDUARDO RANGEL TORRES
MT;5107305;SAO JOSE DO RIO CLARO;50207;P72418;ESCOLA ESTADUAL DR. ANÍSIO JOSÉ MOREIRA
MT;5107602;RONDONOPOLIS;50222;P72545;INSTITUTO FEDERAL MATO GROSSO CAMPUS RONDONÓPOLIS
MT;5107602;RONDONOPOLIS;50221;P72935;EE MAJOR OTÁVIO PITALUGA
MT;5107859;SAO FELIX DO ARAGUAIA;50224;P72848;E. E. PRES. TANCREDO DE A. NEVES
MT;5107875;SAPEZAL;50223;P72873;ESCOLA LUIZ FRUTUOSO DA SILVA
MT;5107909;SINOP;50225;P71567;ESCOLA ESTADUAL PROFESSORA EDELI MANTOVANI
MT;5107925;SORRISO;50226;P72375;INSTITUTO FEDERAL DE MATO GROSSO CAMPUS SORRISO
MT;5107958;TANGARA DA SERRA;50230;P70326;ESCOLA ESTADUAL 13 DE MAIO
MT;5108006;TAPURAH;50227;P73609;ESCOLA ESTADUAL CÂNDIDO PORTINARI
MT;5108055;TERRA NOVA DO NORTE;50228;P73060;ESCOLA ESTADUAL 12 DE ABRIL
MT;5108402;VARZEA GRANDE;50197;P70682;ESCOLA ESTADUAL PROFª ADALGISA DE BARROS
MT;5108402;VARZEA GRANDE;50196;P72119;ESCOLA ESTADUAL PROFESSOR JOSÉ MENDES MARTINS
MT;5108501;VERA;50231;P73281;INSTITUTO EDUCACIONAL SUPERAÇÃO
MT;5108600;VILA RICA;50232;P72630;EE MARIA ESTHER PERES
MT;5108956;NOVA MONTE VERDE;50191;P71976;ESCOLA ESTADUAL PROFESSORA NEIDE ENARA SIMA
PA;1500107;ABAETETUBA;50027;P74238;EEEFM PROF. BASÍLIO DE CARVALHO
PA;1500206;ACARA;50029;P71516;ESCOLA ESTADUAL DE ENSINO MEDIO FELIPE PATRONI
PA;1500305;AFUA;50030;P73741;ESCOLA ESTADUAL DE ENSINO MÉDIO LEOPOLDINA GUERREIRO
PA;1500404;ALENQUER;50098;P72983;EMEEF VEREADOR JOAQUIM VALENTE
PA;1500503;ALMEIRIM;50099;P73511;EMFF FREI CONSTÂNCIO
PA;1500602;ALTAMIRA;50021;P68490;EMEF PROF.º ANTÔNIO GONDIM LINS
PA;1500701;ANAJAS;50032;P72715;EMEF MARIA IRANEDE COUTINHO
PA;1500800;ANANINDEUA;50041;P68413;EEEFM LUIZ NUNES DIREITO
PA;1500800;ANANINDEUA;50042;P70599;INSTITUTO FEDERAL DE EDUCAÇÃO  CIÊNCIA E TECNOLOGIA  DO PARÁ CAMPUS ANANINDEUA
PA;1500859;ANAPU;50031;P73217;EMEF MARIA DAS DORES
PA;1501204;BAIAO;50053;P71669;UNIVERSIDADE FEDERAL DO PARA-POLO BAIÃO
PA;1501303;BARCARENA;50076;P70952;EETEPA MARIA SIQUEIRA DOS SANTOS DIAS
PA;1501402;BELEM;50046;P70649;UFRA - UNIVERSIDADE FEDERAL RURAL DA AMAZÔNIA
PA;1501402;BELEM;50043;P71919;UNAMA ALCINDO CACELA
PA;1501402;BELEM;50044;P71919;UNAMA ALCINDO CACELA
PA;1501402;BELEM;50045;P71919;UNAMA ALCINDO CACELA
PA;1501402;BELEM;50047;P71919;UNAMA ALCINDO CACELA
PA;1501451;BELTERRA;50033;P73221;E.M.E.F SANTO ANTÔNIO
PA;1501501;BENEVIDES;50048;P72002;EEEFM PROFESSORA ANA TELES
PA;1501709;BRAGANCA;50034;P70632;UNIVERSIDADE FEDERAL DO PARÁ UFPA CAMPUS UNIVERSITÁRIO DE BRAGANÇA
PA;1501782;BREU BRANCO;50095;P73401;EEEM SEVERO ALVES
PA;1501808;BREVES;50035;P70902;UNIVERSIDADE FEDERAL DO PARÁ UFPA
PA;1502103;CAMETA;50038;P68779;EMEF SÃO JOÃO BATISTA
PA;1502152;CANAA DOS CARAJAS;50078;P70558;EEEM JOÃO NELSON DOS PRAZERES HENRIQUES
PA;1502202;CAPANEMA;50040;P70327;EEEFM DOM JOÃO VI
PA;1502301;CAPITAO POCO;50039;P73326;EEEFM OSVALDO CRUZ
PA;1502400;CASTANHAL;50036;P68513;ESTÁCIO CASTANHAL
PA;1502707;CONCEICAO DO ARAGUAIA;50079;P73179;EEEFM PROFESSOR DEOCLECIANO ALVES MOREIRA
PA;1502756;CONCORDIA DO PARA;50072;P72174;E.M.E.F. NOSSA SENHORA DE GUADALUPE
PA;1502806;CURRALINHO;50050;P73265;EPAM PROF LINDALVA PINHO
PA;1502939;DOM ELISEU;50080;P73409;COLÉGIO SEBASTIÃO SARAIVA
PA;1502954;ELDORADO DO CARAJAS;50087;P73526;EMEF OGILVANISE MOREIRA DE MOURA
PA;1503093;GOIANESIA DO PARA;50081;P73333;E.M.E.F. E EJA  GOV. ALACID NUNES
PA;1503101;GURUPA;50051;P73270;EMEF RIBEIRO DIAS
PA;1503200;IGARAPE-ACU;50037;P73602;ESCOLA ESTADUAL JOSÉ ELIAS EMIN
PA;1503309;IGARAPE-MIRI;50028;P73213;EEEM ENEDINA SAMPAIO MELO
PA;1503606;ITAITUBA;50022;P71160;E.E.E.M BENEDITO CORRÊA DE SOUZA
PA;1503705;ITUPIRANGA;50083;P72950;EEEFM PROFESSORA ALBERTINA BARREIROS
PA;1503804;JACUNDA;50082;P73245;E.E.E.M. MARIA DA GLÓRIA RODRIGUES PAIXÃO
PA;1503903;JURUTI;50100;P73444;EEEFM EMANUEL SALGADO VIEIRA
PA;1504059;MAE DO RIO;50052;P74629;E.M.E.F.PADRE LOURENÇO SCOTTI
PA;1504208;MARABA;50084;P68568;EMEF PROFESSOR JONATHAS PONTES ATHIAS
PA;1504208;MARABA;50085;P68573;EMEF PROF SALOMÉ CARVALHO
PA;1504422;MARITUBA;50049;P71059;EMEF PE ROMEU PIRES BORGES
PA;1504604;MOCAJUBA;50054;P73498;EEEM PROF. ISAURA BAIA
PA;1504703;MOJU;50055;P71625;E.E.E.M.PROFESSORA ERNESTINA PEREIRA MAIA
PA;1504802;MONTE ALEGRE;50101;P72533;UFOPA CAMPUS MONTE ALEGRE
PA;1504901;MUANA;50056;P71538;EMEF ÂNGELO NASCIMENTO
PA;1505031;NOVO PROGRESSO;50023;P70983;ESCOLA ESTADUAL DE ENSINO MÉDIO WALDEMAR LINDERMAYER
PA;1505064;NOVO REPARTIMENTO;50086;P73246;EMEF JOSÉ CÍCERO  DA SILVA
PA;1505106;OBIDOS;50102;P71802;ESCOLA MUNICIPAL DOUTOR RAYMUNDO CHAVES
PA;1505205;OEIRAS DO PARA;50057;P73439;EMEF JERÔNIMO MILHOMEM TAVARES
PA;1505304;ORIXIMINA;50103;P73452;ESCOLA ESTADUAL DE EDUCAÇÃO PROFISSIONAL TECNOLÓGICA DE ORIXIMINÁ
PA;1505437;OURILANDIA DO NORTE;50058;P73722;EMEF MADRE TERESA DE JESUS
PA;1505486;PACAJA;50024;P71744;EMEF PACAJÁ
PA;1505502;PARAGOMINAS;50062;P71033;E.M.E.F. BELARMINA FERNANDES
PA;1505502;PARAGOMINAS;50063;P71517;INSTITUTO FEDERAL DO PARÁ IFPA – CAMPUS PARAGOMINAS
PA;1505536;PARAUAPEBAS;50088;P73256;FACULDADE ANHANGUERA DE PARAUAPEBAS
PA;1505650;PLACAS;50060;P73745;EMEF PRESIDENTE TANCREDO NEVES
PA;1505700;PONTA DE PEDRAS;50059;P72059;E.E.E.M. DALCIDIO JURANDIR
PA;1505809;PORTEL;50061;P71820;EMEF DILMA DOS SANTOS CARVALHO
PA;1505908;PORTO DE MOZ;50025;P71735;EMEF PROFª. MARIA ZILDA SOUTO GONÇALVES
PA;1506005;PRAINHA;50104;P73407;ESCOLA ESTADUAL DE ENSINO MÉDIO PRETEXTATO DA COSTA ALVARENGA
PA;1506138;REDENCAO;50089;P70406;EEEM PROFª. DEUZUITA PEREIRA DE QUEIROZ
PA;1506187;RONDON DO PARA;50090;P70505;EEEM DR DIONÍSIO BENTES DE CARVALHO
PA;1506195;RUROPOLIS;50105;P72356;E.M.E.F. GOV. EURICO VALLE
PA;1506203;SALINOPOLIS;50066;P71969;UNIVERSIDADE FEDERAL DO PARÁ - CAMPUS SALINÓPOLIS
PA;1506302;SALVATERRA;50067;P73891;EEEM SALOMÃO MATOS
PA;1506500;SANTA IZABEL DO PARA;50069;P73215;ESCOLA MUNICIPAL DE ENSINO FUNDAMENTAL ANTÔNIO LEMOS
PA;1506708;SANTANA DO ARAGUAIA;50091;P71545;EMEF. THEREZINHA ABREU VITA
PA;1506807;SANTAREM;50106;P68720;UFOPA - UNIDADE TAPAJÓS
PA;1506807;SANTAREM;50107;P68720;UFOPA - UNIDADE TAPAJÓS
PA;1507003;SANTO ANTONIO DO TAUA;50064;P73766;ESCOLA ESTADUAL DE ENSINO MÉDIO INACIO MOURA
PA;1507300;SAO FELIX DO XINGU;50093;P73201;E.E.E.MÉDIO CARMINA GOMES
PA;1507458;SAO GERALDO DO ARAGUAIA;50092;P71977;EMEF RAIMUNDO FERREIRA LIMA
PA;1507607;SAO MIGUEL DO GUAMA;50068;P73262;EMEF. RAIMUNDA DE OLIVEIRA MACHADO
PA;1507706;SAO SEBASTIAO DA BOA VISTA;50065;P73207;EMEF MAGALHÃES BARATA
PA;1507953;TAILANDIA;50070;P73260;EEEM SÃO FRANCISCO DE ASSIS
PA;1507979;TERRA SANTA;50071;P73371;EMEF PROFESSORA RAIMUNDA DA COSTA BENTES
PA;1508001;TOME-ACU;50073;P70295;EEEM ANTÔNIO BRASIL
PA;1508084;TUCUMA;50094;P73202;ESCOLA MUNICIPAL DE ENSINO FUNDAMENTAL PRO MULHER
PA;1508100;TUCURUI;50096;P70837;EEEM DEPUTADO RAIMUNDO RIBEIRO DE SOUZA
PA;1508126;ULIANOPOLIS;50074;P73328;EMEF VALE DO GURUPIZINHO
PA;1508159;URUARA;50026;P72638;E.E.E.M. MELVIN JOMES
PA;1508209;VIGIA;50075;P71680;ESCOLA MUNICIPAL DE ENSINO FUNDAMENTAL NOÊMIA BELÉM
PA;1508308;VISEU;50077;P73752;ESCOLA ESTADUAL DE ENSINO MÉDIO PADRE LUCIANO CALDERARA
PA;1508407;XINGUARA;50097;P73269;ESCOLA MUNICIPAL DE ENSINO INFANTIL E FUNDAMENTAL PROF. ACY DE BARROS PEREIRA
PB;2501500;BANANEIRAS;50468;P70509;CCHSA CAMPUS III UFPB
PB;2501807;BAYEUX;50452;P71503;ESCOLA TÉCNICA ESTADUAL DE BAYEUX
PB;2501906;BELEM;50453;P72156;EDUCAR COLÉGIO E CURSO
PB;2503209;CABEDELO;50454;P70333;INSTITUTO FEDERAL DE EDUCAÇÃO, CIÊNCIA E TECNOLOGIA
PB;2503704;CAJAZEIRAS;50471;P70635;IFPB - CAMPUS CAJAZEIRAS
PB;2504009;CAMPINA GRANDE;50478;P70341;UFCG - CAMPUS CAMPINA GRANDE
PB;2504009;CAMPINA GRANDE;50479;P70341;UFCG - CAMPUS CAMPINA GRANDE
PB;2504306;CATOLE DO ROCHA;50472;P72041;IFPB - CAMPUS CATOLÉ DO ROCHA
PB;2505105;CUITE;50480;P71905;EEEF ANDRÉ VIDAL DE NEGREIROS
PB;2506004;ESPERANCA;50455;P71227;IFPB - CAMPUS ESPERANÇA
PB;2506301;GUARABIRA;50469;P70708;IFPB - CAMPUS GUARABIRA
PB;2506905;ITABAIANA;50456;P71260;ESCOLA CIDADÃ INTEGRAL TÉCNICA ESTADUAL DE ITABAIANA DR. ANTÔNIO BATISTA SANTIAGO
PB;2507002;ITAPORANGA;50473;P71476;ESCOLA ESTADUAL CIDADÃ TÉCNICA DE ITAPORANGA
PB;2507507;JOAO PESSOA;50457;P70608;UFPB - CENTRAL DE AULAS
PB;2507507;JOAO PESSOA;50458;P70608;UFPB - CENTRAL DE AULAS
PB;2507507;JOAO PESSOA;50459;P70774;UFPB - CCSA
PB;2508901;MAMANGUAPE;50460;P71379;UFPB - CCAE - CAMPUS IV
PB;2509701;MONTEIRO;50481;P71824;INSTITUTO FEDERAL DE EDUCAÇÃO, CIÊNCIA E TECNOLOGIA DA PARAÍBA - IFPB - CAMPUS MONTEIRO
PB;2510808;PATOS;50474;P68488;UFCG - CENTRO DE SAÚDE E TECNOLOGIA RURAL
PB;2510907;PAULISTA;50461;P72134;EMEF CÂNDIDO DE ASSIS QUEIROGA
PB;2511400;PICUI;50482;P71552;IFPB CAMPUS PICUÍ
PB;2512101;POMBAL;50475;P71463;EEEFM ARRUDA CÂMARA
PB;2512903;RIO TINTO;50462;P71804;UFPB CAMPUS IV RIO TINTO
PB;2513406;SANTA LUZIA;50463;P72093;IFPB - CAMPUS SANTA LUZIA
PB;2513703;SANTA RITA;50464;P71374;UFPB - CENTRO DE CIÊNCIAS JURÍDICAS
PB;2513851;SANTO ANDRE;50483;P71208;EMEIEF FENELON MEDEIROS
PB;2513901;SAO BENTO;50476;P72289;EMEIEF DR JARQUES LÚCIO DA SILVA
PB;2514503;SAO JOSE DE PIRANHAS;50465;P71439;ECIT PREFEITO JOAQUIM LACERDA LEITE
PB;2515302;SAPE;50466;P71597;EMEF JÚLIA FIGUEIREDO
PB;2515930;SERTAOZINHO;50467;P72061;EMEF ULISSES MAURICIO DE PONTES
PB;2516003;SOLANEA;50470;P71945;ECIT ALFREDO PESSOA DE LIMA
PB;2516201;SOUSA;50477;P70367;UFCG - CAMPUS SOUSA - UNIDADE II - BR 230
PB;2516300;SUME;50484;P72154;UFCG - CDSA CAMPUS SUME
PE;2600054;ABREU E LIMA;50506;P70993;EREFEM STELA MARIA DOS SANTOS PINTO BARROS
PE;2600104;AFOGADOS DA INGAZEIRA;50485;P72054;AUTARQUIA EDUCACIONAL DE AFOGADOS DA INGAZEIRA - FASP - FACULDADE DO SERTÃO DO PAJEÚ
PE;2600203;AFRANIO;50502;P71344;POLO EDUCADORA SEMIDOCÉIA DA SILVA CAVALCANTI
PE;2600500;AGUAS BELAS;50498;P71277;EREM CORONEL NICOLAU SIQUEIRA
PE;2600906;AMARAJI;50507;P72087;EREM DOM LUIZ DE BRITO
PE;2601102;ARARIPINA;50542;P70548;ESCOLA TÉCNICA ESTADUAL PEDRO MUNIZ FALCÃO
PE;2601201;ARCOVERDE;50486;P70637;ESCOLA DE REFERÊNCIA EM ENSINO MÉDIO DE ARCOVERDE - EREMA
PE;2601409;BARREIROS;50508;P71581;ESCOLA ESTADUAL HÉLIO SANTIAGO RAMOS
