SG_UF_PROVA;CO_MUNICIPIO_PROVA;NO_MUNICIPIO_PROVA;CO_COORDENACAO;CO_LOCAL;NO_LOCAL_PROVA
AC;1200013;ACRELANDIA;50013;P72226;UAB- UNIVERSIDADE ABERTA DO BRASIL- POLO  DE APOIO PRESENCIAL DE ACRELÂNDIA
AC;1200104;BRASILEIA;50007;P71323;INSTITUTO ODILON PRATAGI
AC;1200203;CRUZEIRO DO SUL;50008;P71121;UNIVERSIDADE FEDERAL DO ACRE - CAMPUS FLORESTA
AC;1200302;FEIJO;50011;P71434;ESCOLA ESTADUAL DE ENSINO MÉDIO JOSÉ GURGEL RABELLO
AC;1200336;MANCIO LIMA;50016;P72443;ESCOLA ESTADUAL DE ENSINO FUNDAMENTAL E EJA BELARMINO DE MENDONÇA
AC;1200385;PLACIDO DE CASTRO;50014;P71856;ESCOLA ESTADUAL DE ENSINO FUNDAMENTAL JOSÉ FRANCISCO DA SILVA
AC;1200401;RIO BRANCO;50005;P72985;ESTÁCIO UNIMETA
AC;1200401;RIO BRANCO;50006;P72985;ESTÁCIO UNIMETA
AC;1200450;SENADOR GUIOMARD;50015;P71316;ESCOLA CÍVICO MILITAR ALDACI SIMÕES DA COSTA
AC;1200500;SENA MADUREIRA;50009;P71368;NÚCLEO DA UFAC DE SENA MADUREIRA
AC;1200609;TARAUACA;50010;P72717;ESCOLA DR. DJALMA DA CUNHA BATISTA
AC;1200708;XAPURI;50012;P71863;INSTITUTO FEDERAL DE EDUCAÇÃO, CIÊNCIA E TECNOLOGIA DO ACRE - IFAC - CAMPUS XAPURI
AL;2700300;ARAPIRACA;50413;P68792;UNIVERSIDADE ESTADUAL DE ALAGOAS - UNEAL
AL;2700300;ARAPIRACA;50413;P68792;UNIVERSIDADE ESTADUAL DE ALAGOAS - UNEAL
AL;2700805;BELEM;50418;P71732;ESCOLA ESTADUAL MARQUES DA SILVA
AL;2701407;CAMPO ALEGRE;50414;P71613;ESCOLA MUNICIPAL DE EDUCAÇÃO BÁSICA MONSENHOR HILDEBRANDO VERISSÍMO GUIMARÃES
AL;2701506;CAMPO GRANDE;50419;P73183;ESCOLA DE ENS. FUND. E MÉDIO PROFESSOR DOUGLAS APRATTO TENÓRIO
AL;2702306;CORURIPE;50434;P72882;ESCOLA ESTADUAL DJALMA BARROS SIQUEIRA
AL;2702405;DELMIRO GOUVEIA;50417;P71703;UFAL - UNIVERSIDADE FEDERAL DE ALAGOAS - CAMPUS  DO SERTÃO
AL;2702900;GIRAU DO PONCIANO;50415;P71817;ESCOLA ESTADUAL DEPUTADO GILVAN BARROS
AL;2704302;MACEIO;50422;P68110;FACULDADE ESTÁCIO DE ALAGOAS - FAL
AL;2704302;MACEIO;50423;P68110;FACULDADE ESTÁCIO DE ALAGOAS - FAL
AL;2704302;MACEIO;50420;P69044;ANHANGUERA
AL;2704302;MACEIO;50421;P69044;ANHANGUERA
AL;2704500;MARAGOGI;50430;P71406;ESCOLA ESTADUAL BATISTA ACIOLI
AL;2704609;MARAVILHA;50424;P72837;ESCOLA ESTADUAL PROFESSOR ATANAGILDO BRANDÃO
AL;2704708;MARECHAL DEODORO;50425;P72161;INSTITUTO FEDERAL DE ALAGOAS - CAMPUS MARECHAL DEODORO
AL;2705507;MURICI;50431;P72090;ESCOLA MUNICIPAL DE ENSINO FUNDAMENTAL PEDRO TENÓRIO RAPOSO
AL;2705705;OLHO DAGUA DAS FLORES;50436;P72107;ESCOLA ESTADUAL PADRE ANTÔNIO DUARTE
AL;2706307;PALMEIRA DOS INDIOS;50432;P68211;UNIVERSIDADE ESTADUAL DE ALAGOAS - UNEAL CAMPUS III
AL;2706406;PAO DE ACUCAR;50433;P72089;FASVIPA - FACULDADE INTEGRADA SÃO VICENTE
AL;2706703;PENEDO;50435;P71407;INSTITUTO FEDERAL - CAMPUS PENEDO
AL;2707701;RIO LARGO;50426;P71480;ESCOLA ESTADUAL PROFESSORA CLAUDIZETE LIMA ELEUTÉRIO
AL;2708006;SANTANA DO IPANEMA;50437;P71685;EMEB SANTA SOFIA
AL;2708600;SAO MIGUEL DOS CAMPOS;50427;P71487;ESCOLA MUNICIPAL DESEMBARGADOR JOSÉ FERNANDO LIMA SOUZA
AL;2708808;SAO SEBASTIAO;50428;P72939;ESCOLA ESTADUAL PROFESSOR JOSE FELIX DE CARVALHO ALVES
AL;2709152;TEOTONIO VILELA;50416;P71321;ESCOLA MUNICIPAL DE ENSINO FUNDAMENTAL DOM AVELAR BRANDÃO VILELA
AL;2709301;UNIAO DOS PALMARES;50429;P71255;ESCOLA ESTADUAL DR. PAULO DE CASTRO SARMENTO
AM;1300607;BENJAMIN CONSTANT;50118;P71690;UFAM-INSTITUTO DE NATUREZA E CULTURA
AM;1300680;BOA VISTA DO RAMOS;50111;P71263;NÚCLEO DE ENSINO SUPERIOR DE BOA VISTA DO RAMOS - UEA
AM;1300706;BOCA DO ACRE;50108;P72727;ESCOLA ESTADUAL BARÃO DE BOCA DO ACRE
AM;1300805;BORBA;50121;P71164;ESCOLA ESTADUAL LOTHAR SUSSMANN
AM;1300839;CAAPIRANGA;50128;P72736;ESCOLA ESTADUAL CARMINA DE CASTRO
AM;1301001;CARAUARI;50129;P72971;NÚCLEO DE ENSINO SUPERIOR DE CARAUARI
AM;1301100;CAREIRO;50126;P74759;ESCOLA ESTADUAL MARÇAL MACHADO GIRÃO
AM;1301209;COARI;50109;P71543;UEA - NÚCLEO DE ENSINO SUPERIOR DE COARI
AM;1301308;CODAJAS;50123;P71870;ESCOLA ESTADUAL PROFESSOR LUIZ GONZAGA DE SOUZA FILHO
AM;1301704;HUMAITA;50137;P72001;IEAA/UFAM - INSTITUTO DE EDUCAÇÃO, AGRICULTURA E AMBIENTE
AM;1301852;IRANDUBA;50115;P71397;ESCOLA ESTADUAL ISAÍAS VASCONCELOS
AM;1301902;ITACOATIARA;50119;P70619;UFAM - CAMPUS MOYSÉS BENARROS ISRAEL
AM;1302504;MANACAPURU;50116;P71245;ESCOLA ESTADUAL VIRGILIA ALEXANDRE MADDY
AM;1302603;MANAUS;50130;P72997;UNIVERSIDADE NILTON LINS - CAMPUS PARQUE DAS LARANJEIRAS
AM;1302603;MANAUS;50131;P72997;UNIVERSIDADE NILTON LINS - CAMPUS PARQUE DAS LARANJEIRAS
AM;1302603;MANAUS;50132;P72997;UNIVERSIDADE NILTON LINS - CAMPUS PARQUE DAS LARANJEIRAS
AM;1302603;MANAUS;50133;P72997;UNIVERSIDADE NILTON LINS - CAMPUS PARQUE DAS LARANJEIRAS
AM;1302603;MANAUS;50134;P72997;UNIVERSIDADE NILTON LINS - CAMPUS PARQUE DAS LARANJEIRAS
AM;1302603;MANAUS;50135;P72997;UNIVERSIDADE NILTON LINS - CAMPUS PARQUE DAS LARANJEIRAS
AM;1302603;MANAUS;50136;P72997;UNIVERSIDADE NILTON LINS - CAMPUS PARQUE DAS LARANJEIRAS
AM;1302702;MANICORE;50122;P71610;NÚCLEO DE ESTUDOS SUPERIORES DE MANICORÉ - UEA
AM;1302900;MAUES;50112;P71899;UNIVERSIDADE DO ESTADO DO AMAZONAS - UEA - MAUÉS
AM;1303106;NOVA OLINDA DO NORTE;50120;P72644;INSTITUTO FACUP - FAMETRO - POLO NOVA OLINDA
AM;1303205;NOVO AIRAO;50114;P73844;ESCOLA ESTADUAL JOAQUIM DE PAULA
AM;1303403;PARINTINS;50113;P70882;CENTRO DE ESTUDOS SUPERIORES DE PARINTINS - CESP UEA
AM;1303536;PRESIDENTE FIGUEIREDO;50125;P72180;CETI MARIA EVA DOS SANTOS
AM;1303569;RIO PRETO DA EVA;50127;P74723;ESCOLA MUNICIPAL GOVERNADOR GILBERTO MESTRINHO
AM;1303809;SAO GABRIEL DA CACHOEIRA;50124;P74708;ESCOLA ESTADUAL SAGRADA FAMÍLIA
AM;1304062;TABATINGA;50117;P71746;CENTRO DE ESTUDOS SUPERIORES DE TABATINGA - UEA
AM;1304203;TEFE;50110;P71128;CENTRO DE ESTUDOS SUPERIORES DE TEFE - CEST - UEA
AP;1600279;LARANJAL DO JARI;50003;P72710;INSTITUTO FEDERAL DO AMAPÁ
AP;1600303;MACAPA;50000;P70189;FACULDADE ESTÁCIO - SEAMA
AP;1600501;OIAPOQUE;50002;P71268;UNIVERSIDADE FEDERAL DO AMAPÁ - UNIFAP - CAMPUS BINACIONAL
AP;1600535;PORTO GRANDE;50004;P72926;INSTITUTO FEDERAL CIÊNCIAS E TECNOLOGIA DO AMAPÁ - CAMPUS PORTO GRANDE
AP;1600600;SANTANA;50001;P70497;INSTITUTO FEDERAL DE EDUCAÇÃO, CIÊNCIA E TECNOLOGIA DDO AMAPÁ - CAMPUS SANTANA
BA;2900108;ABAIRA;50753;P72204;COLÉGIO ESTADUAL DR FRANCISCO ROCHA FILHO
BA;2900702;ALAGOINHAS;50664;P70997;COLÉGIO MODELO LUÍS EDUARDO MAGALHÃES
BA;2900702;ALAGOINHAS;50663;P71000;COLÉGIO ESTADUAL SÃO FRANCISCO
BA;2901007;AMARGOSA;50668;P71566;COLÉGIO ESTADUAL PEDRO CALMON
BA;2901106;AMELIA RODRIGUES;50754;P72844;COLÉGIO MUNICIPAL GOVERNADOR LUIZ VIANA FILHO
BA;2902104;ARACI;50781;P71803;CENTRO TERRITORIAL DE EDUCAÇÃO PROFISSIONAL DE ARACI - CETEP ARACI
BA;2902708;BARRA;50669;P73367;COLÉGIO ESTADUAL DE TEMPO INTEGRAL BARRA
BA;2902807;BARRA DA ESTIVA;50672;P71754;COLÉGIO ESTADUAL DE TEMPO INTEGRAL PROFESSORA ANA LÚCIA AGUIAR VIANA - CENAD 1
BA;2903201;BARREIRAS;50671;P70796;UNIVERSIDADE FEDERAL DO OESTE DA BAHIA (UFOB) - CAMPUS BARREIRAS
BA;2903904;BOM JESUS DA LAPA;50670;P71512;UNIVERSIDADE FEDERAL DO OESTE DA BAHIA (UFOB) - CAMPUS BOM JESUS DA LAPA
BA;2904100;BOQUIRA;50735;P72754;ESCOLA MUNICIPAL  ANTÔNIO CARLOS MAGALHÃES
BA;2904605;BRUMADO;50673;P71195;ESCOLA MUNICIPAL EM TEMPO INTEGRAL PROFESSORA ZILDA LIMA NEVES
BA;2904753;BURITIRAMA;50674;P71890;COLÉGIO ANTÔNIO RODRIGUES VIANA
BA;2904902;CACHOEIRA;50787;P71819;CENTRO DE ARTES HUMANIDADES E LETRAS - CAHL/UFRB
BA;2905008;CACULE;50675;P71144;COLÉGIO ESTADUAL DE TEMPO INTEGRAL NORBERTO FERNANDES
BA;2905107;CAEM;50755;P73624;ESCOLA MUNICIPAL OTAVIO MANGABEIRA
BA;2905206;CAETITE;50676;P71249;UNIVERSIDADE DO ESTADO DA BAHIA (UNEB) - DEPARTAMENTO DE CIÊNCIAS HUMANAS (DCH) - CAMPUS VI
BA;2905602;CAMACAN;50717;P72621;GRUPO ESCOLAR PRESIDENTE MÉDICI
BA;2905701;CAMACARI;50677;P74301;CENTRO TERRITORIAL DE EDUCAÇÃO PROFISSIONAL DA REGIÃO METROPOLITANA DE SALVADOR - CETEP - RMS
BA;2905800;CAMAMU;50686;P71650;COLÉGIO ESTADUAL LUIZ ROGÉRIO DE SOUZA
BA;2906006;CAMPO FORMOSO;50780;P71928;UNIVERSIDADE PITÁGORAS - UNOPAR ANHANGUERA
BA;2906501;CANDEIAS;50678;P71815;COLÉGIO ESTADUAL LUIZ VIANA FILHO
BA;2906808;CANSANCAO;50692;P72567;ESCOLA MUNICIPAL PROFESSORA DIONÊ OLIVEIRA PASSOS
BA;2906873;CAPIM GROSSO;50722;P71944;ESCOLA MUNICIPAL OTAVIANO FERREIRA DOS SANTOS
BA;2907202;CASA NOVA;50756;P73276;FACULDADE ALFREDO NASSER
BA;2907509;CATU;50665;P72660;INSTITUTO FEDERAL BAIANO CAMPUS CATU
BA;2908101;COCOS;50687;P71585;COLÉGIO MUNICIPAL LEALDINO TEODORO DOS SANTOS
BA;2908200;CONCEICAO DA FEIRA;50757;P72814;COLÉGIO ESTADUAL DE TEMPO INTEGRAL DE CONCEIÇAO DA FEIRA
BA;2908408;CONCEICAO DO COITE;50684;P70384;UNIVERSIDADE DO ESTADO DA BAHIA (UNEB) - DEPARTAMENTO DE EDUCAÇÃO (DEDC) - CAMPUS XIV
BA;2908507;CONCEICAO DO JACUIPE;50698;P71513;UNEF EAD - POLO CONCEIÇÃO DO JACUÍPE
BA;2909208;CORONEL JOAO SA;50685;P73851;COLÉGIO ESTADUAL DE TEMPO INTEGRAL SANTO ANTÔNIO
BA;2909307;CORRENTINA;50783;P72634;COLÉGIO ESTADUAL DE TEMPO INTEGRAL DE CORRENTINA
BA;2909802;CRUZ DAS ALMAS;50749;P71296;CETEP - CENTRO TERRITORIAL DE EDUCACAO PROFISSIONAL RECÔNCAVO II ALBERTO TÔRRES
BA;2910057;DIAS DAVILA;50679;P72687;PÓLO UNIVERSITÁRIO UNICESUMAR DIAS DÁVILA
BA;2910503;ENTRE RIOS;50666;P72676;COLÉGIO ESTADUAL DE TEMPO INTEGRAL DUQUE DE CAXIAS
BA;2910602;ESPLANADA;50690;P71363;COLÉGIO ESTADUAL DE TEMPO INTEGRAL PROFESSORA JOANICE BACELAR BATISTA (ANTIGO CELINA SARAIVA)
BA;2910701;EUCLIDES DA CUNHA;50693;P72122;UNIVERSIDADE DO ESTADO DA BAHIA- CAMPUS XXII
BA;2910727;EUNAPOLIS;50695;P72069;UNOPAR
BA;2910750;FATIMA;50697;P72067;CEAT
BA;2910800;FEIRA DE SANTANA;50705;P70517;COLÉGIO MODELO LUÍS EDUARDO MAGALHÃES
BA;2910800;FEIRA DE SANTANA;50703;P70571;UNIFACS - FEIRA DE SANTANA - CAMPUS SANTA MÔNICA
BA;2910800;FEIRA DE SANTANA;50704;P70571;UNIFACS - FEIRA DE SANTANA - CAMPUS SANTA MÔNICA
BA;2910800;FEIRA DE SANTANA;50706;P70714;COLÉGIO ESTADUAL DE TEMPO INTEGRAL PROFESSORA ANA ALICE FIGUEREDO DOS SANTOS (ANTIGO COLÉGIO POLIVALENTE)
BA;2910800;FEIRA DE SANTANA;50702;P74280;CENTRO INTEGRADO DE EDUCAÇÃO ASSIS CHATEAUBRIAND
BA;2911105;FORMOSA DO RIO PRETO;50701;P73073;CENTRO TERRITORIAL DE EDUCAÇÃO PROFISSIONAL ALMIR TEIXEIRA DOS SANTOS
BA;2911204;GANDU;50707;P71786;ESCOLA MUNICIPAL PROFESSORA CERES LIBÂNIO
BA;2911709;GUANAMBI;50709;P70849;UNIVERSIDADE DO ESTADO DA BAHIA (UNEB) - DEPARTAMENTO DE EDUCAÇÃO (DEDC) - CAMPUS XII
BA;2912202;IBICOARA;50659;P73061;COLÉGIO ESTADUAL DE TEMPO INTEGRAL DE IBICOARA
BA;2913200;IBOTIRAMA;50712;P71460;ESCOLA MUNICIPAL REUNIDAS RUI BARBOSA
BA;2913507;IGUAI;50660;P71938;COLÉGIO ESTADUAL DUQUE DE CAXIAS
BA;2913606;ILHEUS;50715;P70231;UNIVERSIDADE ESTADUAL DE SANTA CRUZ (UESC)
BA;2913606;ILHEUS;50716;P70231;UNIVERSIDADE ESTADUAL DE SANTA CRUZ (UESC)
BA;2913903;IPIAU;50725;P71710;COLÉGIO MUNICIPAL PROFESSORA CELESTINA BITTENCOURT
BA;2914000;IPIRA;50720;P72044;INSTITUTO DE EDUCAÇÃO E FORMAÇÃO LIVRE
BA;2914406;IRAQUARA;50778;P72684;ESCOLA ESTADUAL DE TEMPO INTEGRAL DE IRAQUARA
BA;2914604;IRECE;50721;P70766;COLÉGIO ESTADUAL LUIZ VIANA FILHO
BA;2914653;ITABELA;50696;P72135;COLÉGIO ESTADUAL DE TEMPO INTEGRAL PAULO FREIRE
BA;2914703;ITABERABA;50710;P70642;UNIVERSIDADE DO ESTADO DA BAHIA (UNEB) - DEPARTAMENTO DE EDUCAÇÃO (DEDC) - CAMPUS XIII
BA;2914802;ITABUNA;50718;P70804;UNEX - FACULDADE DE EXCELÊNCIA
BA;2915502;ITAJUIPE;50758;P72594;ESCOLA MUNICIPAL PROFESSOR DIÓGENES VINHAES
BA;2915601;ITAMARAJU;50714;P72816;ESCOLA MUNICIPAL PRESIDENTE MÉDICI
BA;2916401;ITAPETINGA;50713;P72704;COLÉGIO POLIVALENTE DE ITAPETINGA
BA;2917003;ITIUBA;50661;P71836;COLÉGIO ESTADUAL DE TEMPO INTEGRAL ARY SILVA
BA;2917300;ITUBERA;50790;P72596;COLÉGIO ESTADUAL IDELZITO ELOY DE ABREU
BA;2917508;JACOBINA;50723;P70507;DEPARTAMENTO DE CIÊNCIAS HUMANAS CAMPUS IV - UNEB
BA;2917607;JAGUAQUARA;50726;P71665;COLÉGIO LUZIA SILVA
BA;2918001;JEQUIE;50727;P70875;UNIVERSIDADE ESTADUAL DO SUDOESTE DA BAHIA (UESB) - CAMPUS DE JEQUIÉ
BA;2918100;JEREMOABO;50759;P72604;ESCOLA MUNICIPAL DR. CARVALHO SÁ
BA;2918407;JUAZEIRO;50728;P71392;UNIFTC - FACULDADE DE TECNOLOGIA E CIÊNCIAS
BA;2919207;LAURO DE FREITAS;50729;P70597;UNIME - CENTRO UNIVERSITÁRIO - UNIDADE DE LAURO DE FREITAS
BA;2919207;LAURO DE FREITAS;50730;P70597;UNIME - CENTRO UNIVERSITÁRIO - UNIDADE DE LAURO DE FREITAS
BA;2919504;LIVRAMENTO DE NOSSA SENHORA;50733;P71498;UNOPAR
BA;2919553;LUIS EDUARDO MAGALHAES;50732;P71299;COLÉGIO ESTADUAL DE TEMPO INTEGRAL MIMOSO DO OESTE
BA;2919553;LUIS EDUARDO MAGALHAES;50731;P73446;FACULDADE DOM PEDRO (UNIDOM) - LUÍS EDUARDO MAGALHÃES
BA;2919801;MACAUBAS;50736;P71541;COLÉGIO ESTADUAL CÔNEGO FIRMINO SOARES
BA;2919926;MADRE DE DEUS;50760;P73635;COMPLEXO DE EDUCAÇÃO MUNICIPAL PROFESSOR MAGALHÃES NETTO
BA;2920502;MARACAS;50737;P71104;CNMM - COLÉGIO NORMAL MUNICIPAL DE MARACÁS
BA;2921005;MATA DE SAO JOAO;50680;P72263;ESCOLA MUNICIPAL CELIA GOULART DE FREITAS
BA;2921104;MEDEIROS NETO;50738;P72745;GINÁSIO JOÃO XXIII
BA;2921203;MIGUEL CALMON;50724;P72643;COLÉGIO ESTADUAL NOSSA SENHORA DA CONCEIÇÃO
BA;2921500;MONTE SANTO;50694;P72517;COLÉGIO ESTADUAL DE TEMPO INTEGRAL SANTA CRUZ
BA;2921708;MORRO DO CHAPEU;50739;P72811;COLÉGIO MUNICIPALIZADO CORONEL DIAS COELHO
BA;2922003;MUCURI;50761;P72232;ESCOLA MUNICIPAL DEPUTADO FEDERAL LUIS EDUARDO MAGALHÃES
BA;2923209;OLIVEIRA DOS BREJINHOS;50762;P72612;COLÉGIO ESTADUAL DE TEMPO INTEGRAL TIRADENTES
BA;2923407;PALMAS DE MONTE ALTO;50763;P71574;COLÉGIO MUNICIPAL ELIZA TEIXEIRA DE MOURA
BA;2923605;PARAMIRIM;50745;P71688;ESCOLA PROFESSOR JOSÉ CÂNDIDO VIEIRA
BA;2923803;PARIPIRANGA;50742;P72803;ESCOLA MUNICIPAL PROFESSORA MARIA JOSÉ DOS SANTOS LIMA
BA;2924009;PAULO AFONSO;50740;P71053;UNIVERSIDADE DO ESTADO DA BAHIA (UNEB) - DEPARTAMENTO DE EDUCAÇÃO (DEDC) - CAMPUS VIII
BA;2924009;PAULO AFONSO;50741;P71053;UNIVERSIDADE DO ESTADO DA BAHIA (UNEB) - DEPARTAMENTO DE EDUCAÇÃO (DEDC) - CAMPUS VIII
BA;2924306;PIATA;50662;P71514;COLÉGIO ESTADUAL DE TEMPO INTEGRAL DE PIATÃ (ANTIGO COLÉGIO ESTADUAL CORONEL HORÁCIO DE MATOS)
BA;2925105;POCOES;50743;P71564;ESCOLA MUNICIPAL WOLNEA MACEDO
BA;2925204;POJUCA;50667;P71446;COLÉGIO ESTADUAL PADRE JOÃO MONTEZ
BA;2925303;PORTO SEGURO;50744;P71020;ESCOLA PADRE JOSÉ DE ANCHIETA
BA;2925709;PRESIDENTE JANIO QUADROS;50764;P72764;COLÉGIO ESTADUAL DO CAMPO ERALDO TINOCO
BA;2925758;PRESIDENTE TANCREDO NEVES;50708;P73426;COLÉGIO ESTADUAL MARIA XAVIER DE ANDRADE REIS
BA;2926004;REMANSO;50746;P71547;COLÉGIO ESTADUAL PROFESSORA IRENE DE SOUZA ARAÚJO
BA;2926301;RIACHAO DO JACUIPE;50765;P72176;COLÉGIO ESTADUAL DE TEMPO INTEGRAL MARIA DAGMAR MIRANDA
BA;2926608;RIBEIRA DO POMBAL;50747;P71584;COLÉGIO CENTRAL DE RIBEIRA DO POMBAL
BA;2926707;RIO DE CONTAS;50734;P72214;CIRCEA - ESCOLA MUNICIPAL BARÃO DE MACAÚBAS
BA;2927002;RIO REAL;50691;P71679;COLÉGIO ESTADUAL DOUTOR JOSÉ CARVALHO BAPTISTA
BA;2927200;RUY BARBOSA;50711;P72182;COLÉGIO ESTADUAL DE TEMPO INTEGRAL PROFESSOR MAGALHÃES NETO
BA;2927408;SALVADOR;50768;P69018;UNIVERSIDADE FEDERAL DA BAHIA (UFBA) - PAVILHÃO DE AULAS GLAUBER ROCHA (ANTIGO PAF III)
BA;2927408;SALVADOR;50767;P69031;UNIVERSIDADE FEDERAL DA BAHIA (UFBA) - PAVILHÃO DE AULAS REITOR FELIPE SERPA (ANTIGO PAF I)
BA;2927408;SALVADOR;50774;P69034;UNIVERSIDADE FEDERAL DA BAHIA (UFBA) - PAVILHÃO DE AULAS DA FEDERAÇÃO IV (PAF IV) - CAMPUS ONDINA
BA;2927408;SALVADOR;50773;P71036;UNIVERSIDADE FEDERAL DA BAHIA (UFBA) - ESCOLA DE ADMINISTRAÇÃO
BA;2927408;SALVADOR;50770;P71039;UNIVERSIDADE FEDERAL DA BAHIA (UFBA) - FACULDADE DE FILOSOFIA E CIÊNCIAS HUMANAS - PAVILHÃO DE AULAS THALES DE AZEVEDO (ANTIGO PASL)
BA;2927408;SALVADOR;50769;P71041;UNIVERSIDADE FEDERAL DA BAHIA (UFBA) - PAVILHÃO DE AULAS DA FEDERAÇÃO VI (PAF VI)
BA;2927408;SALVADOR;50771;P71042;UNIVERSIDADE FEDERAL DA BAHIA (UFBA) - PAVILHÃO DE AULAS DO CANELA HEONIR ROCHA (ANTIGO PAC)
BA;2927408;SALVADOR;50772;P71043;UNIVERSIDADE FEDERAL DA BAHIA (UFBA) - FACULDADE DE MEDICINA
BA;2927408;SALVADOR;50766;P72980;FACULDADE UNIRUY WYDEN - ANTIGA ÁREA 1
BA;2928000;SANTALUZ;50688;P71900;ESCOLA TARCILINA BORGES DE BARROS
BA;2928109;SANTA MARIA DA VITORIA;50784;P71085;UNIVERSIDADE FEDERAL DO OESTE DA BAHIA (UFOB) - CAMPUS SANTA MARIA DA VITÓRIA
BA;2928208;SANTANA;50775;P71309;COLÉGIO ESTADUAL EDVALDO FLORES
BA;2928406;SANTA RITA DE CASSIA;50752;P71693;CENTRO TERRITORIAL DE EDUCAÇÃO PROFISSIONAL SANTA RITA DE CÁSSIA
BA;2928604;SANTO AMARO;50788;P71920;CENTRO EDUCACIONAL PROFESSOR JOSÉ NERY DE MESQUITA (COLÉGIO NERY)
BA;2928703;SANTO ANTONIO DE JESUS;50750;P70906;UNIVERSIDADE FEDERAL DO RECÔNCAVO DA BAHIA (UFRB) - CENTRO DE CIÊNCIAS DA SAÚDE (CCS)
BA;2928802;SANTO ESTEVAO;50699;P72030;ESCOLA MUNICIPAL MARIZÉLIA DE JESUS ROCHA LEAL
BA;2929057;SAO FELIX DO CORIBE;50785;P71708;COLÉGIO ESTADUAL RIO CORRENTE
BA;2929107;SAO FELIPE;50751;P71923;COLÉGIO ESTADUAL SÃO FELIPE
BA;2929206;SAO FRANCISCO DO CONDE;50681;P72577;COLÉGIO ESTADUAL MARTINHO SALES BRASIL
BA;2929305;SAO GONCALO DOS CAMPOS;50700;P72148;COLÉGIO ESTADUAL DE TEMPO INTEGRAL DE SÃO GONÇALO DOS CAMPOS
BA;2929503;SAO SEBASTIAO DO PASSE;50682;P72095;MCPM COLÉGIO MUNICIPAL DR JOÃO PAIM
BA;2929909;SEABRA;50779;P72689;COLÉGIO ESTADUAL DE SEABRA - ESCOLA TEMPO INTEGRAL
BA;2930105;SENHOR DO BONFIM;50786;P72623;UNIVERSIDADE FEDERAL DO VALE DO SÃO FRANCISCO (UNIVASF)
BA;2930501;SERRINHA;50782;P70400;UNEB - DEPARTAMENTO DE EDUCAÇÃO (DEDC) - CAMPUS XI
BA;2930709;SIMOES FILHO;50683;P72274;COLÉGIO ESTADUAL ALBERTO SILVA
BA;2931350;TEIXEIRA DE FREITAS;50789;P70352;UNIVERSIDADE DO ESTADO DA BAHIA (UNEB) - DEPARTAMENTO DE EDUCAÇÃO (DEDC) - CAMPUS X
BA;2931905;TUCANO;50748;P71015;COLÉGIO ESTADUAL DE TEMPO INTEGRAL DE TUCANO
BA;2932002;UAUA;50776;P71416;CENTRO UNIVERSITÁRIO INTERNACIONAL - UNINTER
BA;2932200;UBAITABA;50719;P73052;INSTITUTO FEDERAL DE EDUCAÇÃO, CIÊNCIA E TECNOLOGIA DA BAHIA - CAMPUS UBAITABA
BA;2932804;UTINGA;50777;P73008;COLÉGIO ESTADUAL PROFESSORA ZENAIDE ALVES BARRETO
BA;2932903;VALENCA;50791;P70976;INSTITUTO FEDERAL DE EDUCAÇÃO, CIÊNCIA E TECNOLOGIA DA BAHIA - CAMPUS VALENÇA
BA;2933000;VALENTE;50689;P72127;COLÉGIO ESTADUAL DE VALENTE
BA;2933208;VERA CRUZ;50792;P72210;COLÉGIO ESTADUAL DESEMBARGADOR JÚLIO VIRGÍNIO DE SANTANNA
BA;2933307;VITORIA DA CONQUISTA;50793;P68756;UNEX - UNIDADE DE VITÓRIA DA CONQUISTA
BA;2933307;VITORIA DA CONQUISTA;50794;P68756;UNEX - UNIDADE DE VITÓRIA DA CONQUISTA
BA;2933307;VITORIA DA CONQUISTA;50795;P68756;UNEX - UNIDADE DE VITÓRIA DA CONQUISTA
BA;2933604;XIQUE-XIQUE;50796;P71319;UNIVERSIDADE DO ESTADO DA BAHIA (UNEB) - DEPARTAMENTO DE CIÊNCIAS HUMANAS E TECNOLOGIAS (DCHT) - CAMPUS XXIV
CE;2300200;ACARAU;50253;P71155;E. E. M. T. I. MARIA ALICE RAMOS GOMES
CE;2300309;ACOPIARA;50299;P71972;E. E. F. DR JOSÉ ADONIAS GURGEL DE ALBUQUERQUE
CE;2300754;AMONTADA;50275;P71342;E.E.M RITA ESTELITA DOS SANTOS RODRIGUES
CE;2301000;AQUIRAZ;50308;P72605;EEEP PROFESSORA ALDA FAÇANHA
CE;2301109;ARACATI;50256;P70612;E. E. F. SÃO MARCELINO CHAMPAGNAT
CE;2301604;ASSARE;50309;P72911;COLÉGIO CRIANÇA FELIZ
CE;2301703;AURORA;50310;P72373;E. E. E. P. LEOPOLDINA GONÇALVES QUEZADO
CE;2301901;BARBALHA;50302;P72290;UNIVERSIDADE FEDERAL DO CEARÁ (UFCA) - CAMPUS BARBALHA - FACULDADE DE MEDICINA
CE;2302057;BARROQUINHA;50311;P72849;EEF FRANCISCO BENICIO DE VASCONCELOS
CE;2302107;BATURITE;50258;P71733;INSTITUTO FEDERAL DO CEARÁ - IFCE
CE;2302206;BEBERIBE;50265;P71080;E. M. DESEMBARGADOR PEDRO DE QUEIROZ
CE;2302305;BELA CRUZ;50254;P72611;EMETI JOÃO DAMASCENO VASCONCELOS
CE;2302404;BOA VIAGEM;50259;P71931;E. E. F. PADRE ANTONIO CORREIA DE SÁ
CE;2302503;BREJO SANTO;50260;P72301;UFCA - CAMPUS DE BREJO SANTO
CE;2302602;CAMOCIM;50262;P72371;EEMTI DEPUTADO MURILO AGUIAR
CE;2302701;CAMPOS SALES;50263;P72821;EEEP PRESIDENTE MÉDICI
CE;2302800;CANINDE;50264;P71544;COLÉGIO ESTADUAL PAULO SARASATE
CE;2303501;CASCAVEL;50266;P72414;EEBM BENIGNA PACHECO - ANTIGO EEFM DE CASCAVEL - GRUPO ESCOLAR
CE;2303709;CAUCAIA;50335;P70585;E. E. M. BRANCA CARNEIRO DE MENDONÇA
CE;2304004;COREAU;50312;P71246;EM PROFESSORA IZAURA MARIA DA SILVA
CE;2304103;CRATEUS;50267;P71497;EEMTI LIONS CLUB
CE;2304202;CRATO;50303;P70251;E. E. E. P. MARIA VIOLETA ARRAES DE ALENCAR GERVAISEAU
CE;2304202;CRATO;50304;P74036;E. E. E. P. GOVERNADOR VIRGÍLIO TÁVORA
CE;2304236;CROATA;50332;P72527;EEMTI DE CROATÁ FLÁVIO RODRIGUES
CE;2304285;EUSEBIO;50313;P72392;EEIEF EDUARDO ALVES RAMOS
CE;2304400;FORTALEZA;50314;P70142;ESTÁCIO - UNIDADE CENTRO
CE;2304400;FORTALEZA;50318;P70142;ESTÁCIO - UNIDADE CENTRO
CE;2304400;FORTALEZA;50322;P70169;ESTÁCIO - UNIDADE VIA CORPVS - BLOCO C
CE;2304400;FORTALEZA;50320;P70237;ESTÁCIO - UNIDADE VIA CORPVS - BLOCO E
CE;2304400;FORTALEZA;50319;P70850;CENTRO UNIVERSITÁRIO FARIAS BRITO
CE;2304400;FORTALEZA;50316;P70855;IFCE - INSTITUTO FEDERAL DE EDUCAÇÃO, CIÊNCIA E TECNOLOGIA DO CEARÁ - CAMPUS FORTALEZA
CE;2304400;FORTALEZA;50317;P70855;IFCE - INSTITUTO FEDERAL DE EDUCAÇÃO, CIÊNCIA E TECNOLOGIA DO CEARÁ - CAMPUS FORTALEZA
CE;2304400;FORTALEZA;50321;P71886;UNIFANOR DUNAS
CE;2304400;FORTALEZA;50323;P71886;UNIFANOR DUNAS
CE;2304400;FORTALEZA;50315;P72162;UNIFANOR WYDEN - SEDE BEZERRA DE MENEZES
CE;2304400;FORTALEZA;50324;P74188;ESTÁCIO FIC - SEDE PARANGABA
CE;2304400;FORTALEZA;50325;P74188;ESTÁCIO FIC - SEDE PARANGABA
CE;2305001;GUARACIABA DO NORTE;50270;P72835;EEEP DEPUTADO JOSÉ MARIA MELO
CE;2305233;HORIZONTE;50297;P71214;EMEF JOSE EDUARDO DE SOUSA
CE;2305407;ICO;50268;P72872;EEEP DEPUTADO JOSÉ WALFRIDO MONTEIRO
CE;2305506;IGUATU;50300;P70602;E. E. M. T. I. LICEU DR JOSÉ GONDIM
CE;2305803;IPU;50271;P71562;EEMTI AUTON ARAGÃO
CE;2305902;IPUEIRAS;50272;P71700;EMTI JOSÉ ALOÍSIO ARAGÃO
CE;2306256;ITAITINGA;50326;P71112;E. E. F. DONA CONCEIÇÃO
CE;2306306;ITAPAJE;50274;P71883;EM CAPITÃO MANOEL PINTO DE MESQUITA
CE;2306405;ITAPIPOCA;50276;P70082;CAMPUS DO CENTRO UNIVERSITARIO INTA - FACUL UNINTA ITAPIPOCA
CE;2306553;ITAREMA;50255;P71199;E. E. E. P. PROFESSORA ROSÂNGELA ALBUQUERQUE COUTO
CE;2306900;JAGUARIBE;50278;P72139;EEF ALICE DIÓGENES PINHEIRO
CE;2307007;JAGUARUANA;50281;P71243;UNIC
CE;2307304;JUAZEIRO DO NORTE;50305;P70229;CENTRO UNIVERSITÁRIO DOUTOR LEÃO SAMPAIO- BLOCOS A / B
CE;2307502;LAVRAS DA MANGABEIRA;50269;P72910;EEIF VIRGILIO DE AGUIAR GURGEL
CE;2307601;LIMOEIRO DO NORTE;50279;P74823;EEMTI ARSÊNIO FERREIRA MAIA
CE;2307650;MARACANAU;50327;P70587;UNINASSAU
CE;2307700;MARANGUAPE;50328;P70538;E. E.M. T. I. CAIC SENADOR CARLOS JEREISSATI
CE;2308104;MAURITI;50261;P72822;EEEP PADRE JOÃO BOSCO DE LIMA
CE;2308351;MILHA;50333;P72805;EEMTI EUCLIDES PINHEIRO DE ANDRADE
CE;2308500;MOMBACA;50289;P71926;EEFM ANANIAS DO AMARAL VIEIRA
CE;2308708;MORADA NOVA;50280;P71535;CENTRO DE EDUCAÇÃO BÁSICA CORONEL JOSÉ EPIFÂNIO DAS CHAGAS
CE;2308906;MORRINHOS;50334;P72124;EMEF CORONEL VIRGÍLIO TÁVORA
CE;2309300;NOVA RUSSAS;50273;P71495;ESCOLA ESTADUAL DE ENSINO PROFISSIONALIZANTE MANUEL ABDIAS EVANGELISTA
CE;2309607;PACAJUS;50298;P72789;EEF ARACI GONZAGA DA SILVA
CE;2309706;PACATUBA;50329;P71553;EEEP PROFESSORA LUIZA DE TEODORO VIEIRA
CE;2310100;PALMACIA;50330;P71774;EEFTI JOSÉ IDELFONSO CAMPOS
CE;2310209;PARACURU;50285;P72157;EMEIF ANTÔNIO SALES
CE;2310258;PARAIPABA;50286;P72151;EMEF BETEL
CE;2310704;PENTECOSTE;50287;P72068;EEF FRANCISCO EDSON TABOSA
CE;2311306;QUIXADA;50295;P71340;FACULDADE DE EDUCAÇÃO, CIÊNCIAS E LETRAS DO SERTÃO CENTRAL
CE;2311405;QUIXERAMOBIM;50296;P72662;LICEU DE QUIXERAMOBIM ALFREDO ALMEIDA MACHADO
CE;2311504;QUIXERE;50336;P72929;EEMTI GOVERNADOR MANOEL DE CASTRO FILHO
CE;2311603;REDENCAO;50257;P71745;EEEP ADOLFO FERREIRA DE SOUSA
CE;2311801;RUSSAS;50282;P71698;CE GOVERNADOR FLÁVIO MARCÍLIO
CE;2312205;SANTA QUITERIA;50283;P72550;EEM ARACY MAGALHÃES MARTINS
CE;2312304;SAO BENEDITO;50284;P71117;EEEP ISAIAS GONÇALVES DAMASCENO
CE;2312403;SAO GONCALO DO AMARANTE;50288;P70569;E. E. E. P. WALTER RAMOS DE ARAÚJO
CE;2312700;SENADOR POMPEU;50290;P71241;CENTRO DE EDUCAÇÃO DE JOVENS E ADULTOS-CEJA DE SENADOR POMPEU
CE;2312908;SOBRAL;50307;P68892;UNIVERSIDADE FEDERAL DO CEARÁ UFC- FACULDADE DE MEDICINA CAMPUS SOBRAL
CE;2312908;SOBRAL;50306;P69038;UNIVERSIDADE FEDERAL DO CEARÁ UFC CAMPUS SOBRAL MUCAMBINHO
CE;2313005;SOLONOPOLE;50291;P72551;E.E.F. BOM JESUS
CE;2313104;TABULEIRO DO NORTE;50331;P71123;EEM FRANCISCO MOREIRA FILHO
CE;2313302;TAUA;50292;P71651;EEM MARIA DAS DORES CIDRÃO ALEXANDRINO
CE;2313401;TIANGUA;50293;P71066;FACULDADE IBIAPABA
CE;2313500;TRAIRI;50277;P71506;EEFM RAIMUNDO NONATO RIBEIRO
CE;2313609;UBAJARA;50294;P71143;EEEP GOVERNADOR WALDEMAR ALCÂNTARA
CE;2314003;VARZEA ALEGRE;50301;P72602;EEM JOSÉ CORREIA LIMA
DF;5300108;BRASILIA;50445;P70841;UNIP
DF;5300108;BRASILIA;50446;P70841;UNIP
DF;5300108;BRASILIA;50447;P70841;UNIP
DF;5300108;BRASILIA;50448;P70841;UNIP
DF;5300108;BRASILIA;50449;P70841;UNIP
DF;5300108;BRASILIA;50450;P70848;CENTRO UNIVERSITÁRIO DE BRASÍLIA UNICEUB - TAGUATINGA
DF;5300108;BRASILIA;50451;P70848;CENTRO UNIVERSITÁRIO DE BRASÍLIA UNICEUB - TAGUATINGA
DF;5300108;BRASILIA;50438;P74260;CEUB
DF;5300108;BRASILIA;50439;P74260;CEUB
DF;5300108;BRASILIA;50440;P74260;CEUB
DF;5300108;BRASILIA;50441;P74260;CEUB
DF;5300108;BRASILIA;50442;P74260;CEUB
DF;5300108;BRASILIA;50443;P74260;CEUB
DF;5300108;BRASILIA;50444;P74260;CEUB
ES;3200102;AFONSO CLAUDIO;50821;P72419;CEEFMTI AFONSO CLÁUDIO
ES;3200201;ALEGRE;50802;P72064;FACULDADE DE FILOSOFIA, CIÊNCIAS E LETRAS DE ALEGRE - FAFIA
ES;3200409;ANCHIETA;50825;P73295;EEEFM CORONEL GOMES DE OLIVEIRA
ES;3200607;ARACRUZ;50797;P71343;FACULDADES INTEGRADAS DE ARACRUZ - FAACZ
ES;3200904;BARRA DE SAO FRANCISCO;50800;P71165;CEEMTI CENTRO ESTADUAL DE ENSINO MÉDIO TEMPO INTEGRAL JOÃO XXIII
ES;3201159;BREJETUBA;50822;P71776;EEEFM ÁLVARO CASTELO
ES;3201209;CACHOEIRO DE ITAPEMIRIM;50803;P70385;MULTIVIX CACHOEIRO ENSINO, PESQUISA E EXTENSÃO
ES;3201308;CARIACICA;50826;P70641;FACULDADE MULTIVIX CARIACICA
ES;3201407;CASTELO;50804;P71073;ESCOLA ESTADUAL DE ENSINO FUNDAMENTAL E MÉDIO JOÃO BLEY
ES;3201506;COLATINA;50808;P71724;UNESC CENTRO UNIVERSITÁRIO DO ESPÍRITO SANTO
ES;3201605;CONCEICAO DA BARRA;50817;P71721;EEEM PROFESSOR JOAQUIM FONSECA
ES;3201704;CONCEICAO DO CASTELO;50827;P72940;MULTIVIX
ES;3201902;DOMINGOS MARTINS;50828;P73230;POLO UAB EM DOMINGOS MARTINS
